CAGL0J05852g		Ortholog(s) have role in secondary metabolite biosynthetic process	0.308	9.594e-02	0.103	6.414e-01	0.645	6.453e-03	1.273	2.332e-04	0.302	0.062	1.427	2.118	0	0	0	1		REDOX SIGNALING	FLAVO HEMO PROTEIN	F3	CAGL0J05852g	OFF	0	0	0	UP
CAGL0J05984g		Ortholog(s) have adenine deaminase activity and role in adenine catabolic process, cell-abiotic substrate adhesion, hypoxanthine salvage, purine-containing compound salvage, regulation of G2/M transition of mitotic cell cycle	-1.905	1.645e-05	-2.308	2.764e-05	0.256	1.034e-01	-0.29	3.410e-01	-2.282	-3.107	0.464	-0.616	-1	-1	0	0	AAH1	METABOLISM	NUCLEIC ACID METABOLISM	F1	CAGL0J05984g	OFF	DOWN	DOWN	0	0
CAGL0J06374g		Has domain(s) with predicted structural constituent of ribosome activity, role in translational elongation and ribosome localization	-1.7	2.838e-04	-1.577	1.320e-04	-0.346	1.689e-02	-1.588	1.981e-04	-2.043	-2.146	-1.023	-2.886	-1	-1	0	-1		REGULATION	TRANSLATION	F2	CAGL0J06374g	Type II	DOWN	DOWN	0	DOWN
CAGL0J06380g		Ortholog(s) have ATPase inhibitor activity, enzyme inhibitor activity, role in negative regulation of ATPase activity and mitochondrion localization	-0.964	3.011e-03	-0.488	3.918e-02	0.25	9.419e-02	1.377	3.631e-03	-1.183	-0.715	0.45	2.3	0	0	0	1	INH1	UNCLASSIFIED	_	Others	CAGL0J06380g	OFF	0	0	0	UP
CAGL0J06666g		Ortholog of S. cerevisiae : YML108W, C. albicans SC5314 : CR_06330C_A, C. dubliniensis CD36 : Cd36_31830, C. parapsilosis CDC317 : CPAR2_204870 and C. auris B8441 : B9J08_000809	-0.836	2.002e-03	-0.536	8.582e-02	0.624	1.650e-02	1.829	1.399e-03	-1.033	-0.778	1.374	3.091	0	0	0	1	YML108W	UNCLASSIFIED	_	Others	CAGL0J06666g	OFF	0	0	0	UP
CAGL0J07062g		Ortholog(s) have arginase activity, manganese ion binding, ornithine carbamoyltransferase inhibitor activity, zinc ion binding activity	-1.311	1.413e-03	-1.722	1.228e-05	0.109	5.968e-01	0.049	8.879e-01	-1.589	-2.337	0.101	-0.023	0	-1	0	0	CAR1	REGULATION	OTHERS	F2	CAGL0J07062g	OFF	DOWN	DOWN	0	0
CAGL0J07568g		Ortholog(s) have RNA polymerase II proximal promoter sequence-specific DNA binding, cysteine-type peptidase activity, double-stranded DNA binding, mRNA binding, single-stranded DNA binding activity	1.923	3.159e-06	1.303	1.802e-04	-0.253	5.369e-02	0.196	4.428e-01	2.19	1.639	-0.793	0.234	1	0	0	0	LAP3	STRESS RESPONSE	_	Others	CAGL0J07568g	OFF	UP	UP	0	0
CAGL0J07678g		Ortholog(s) have ribosomal small subunit binding, translation initiation factor activity, translation initiation factor binding activity and role in formation of translation preinitiation complex, maintenance of translational fidelity	-0.358	1.738e-02	-0.713	3.338e-03	0.021	8.728e-01	-1.097	1.715e-03	-0.474	-1.01	-0.116	-2.028	0	0	0	-1	SUI1	REGULATION	TRANSLATION	F2	CAGL0J07678g	OFF	0	0	0	DOWN
CAGL0J07766g		Ortholog(s) have RNA polymerase I activity and role in nucleolar large rRNA transcription by RNA polymerase I, transcription by RNA polymerase I, transcription elongation from RNA polymerase I promoter	-1.633	8.586e-05	-1.664	3.611e-05	-0.03	8.879e-01	-1.221	3.981e-04	-1.965	-2.26	-0.241	-2.244	0	-1	0	-1	RPA49	METABOLISM	NUCLEIC ACID METABOLISM	F1	CAGL0J07766g	Type II	DOWN	DOWN	0	DOWN
CAGL0J07980g		Ortholog(s) have copper chaperone activity and role in cellular copper ion homeostasis, cellular iron ion homeostasis, cellular response to oxidative stress, copper ion transport, regulation of iron ion transmembrane transport	2.854	3.078e-05	1.783	3.945e-04	0.158	5.710e-01	0.434	1.477e-01	3.277	2.271	0.223	0.652	1	1	0	0	ATX1	TRANSPORT / TRAFFICKING	INTRACELLULAR TRANSPORT	F4	CAGL0J07980g	OFF	UP	UP	0	0
CAGL0J08547g		Protein of unknown function	0.65	7.988e-04	0.68	5.089e-03	1.192	3.474e-05	0.765	2.801e-03	0.703	0.82	2.777	1.23	0	0	1	0		METABOLISM	FATTY ACID AND LIPIDS	F1	CAGL0J08547g	OFF	0	0	UP	0
CAGL0J08679g		Ortholog(s) have role in cytoplasmic translation and cytoplasm localization	-1.573	3.076e-05	-1.62	3.451e-05	-0.281	3.746e-02	-0.689	8.145e-03	-1.895	-2.203	-0.862	-1.314	0	-1	0	0	TMA46	METABOLISM	RIBOSOMAL BIOGENESIS	F1	CAGL0J08679g	OFF	DOWN	DOWN	0	0
CAGL0J09240g	LYS21	Homocitrate synthase; protein abundance increased in ace2 mutant cells	-1.179	5.013e-02	-1.678	3.056e-05	0.789	1.943e-03	1.026	7.333e-04	-1.434	-2.279	1.781	1.685	0	-1	0	0	LYS21	METABOLISM	AMINO ACID METABOLISM	F1	CAGL0J09240g	Type I	0	DOWN	UP	UP
CAGL0J09262g		Ortholog(s) have ATPase binding activity, role in negative regulation of ATPase activity and mitochondrion localization	1.783	2.227e-04	1.083	8.589e-04	0.029	8.892e-01	-0.538	4.060e-02	2.027	1.351	-0.095	-1.049	1	0	0	0	STF1	UNCLASSIFIED	_	Others	CAGL0J09262g	OFF	UP	0	0	0
CAGL0J09328g		Ortholog(s) have cyclin-dependent protein serine/threonine kinase regulator activity	0.312	1.021e-01	-0.247	5.937e-01	0.886	1.826e-04	0.456	2.770e-01	0.308	-0.398	2.022	0.689	0	0	1	0	PCL2	REGULATION	OTHERS	F2	CAGL0J09328g	OFF	0	0	UP	0
CAGL0J09614g		Ortholog(s) have box H/ACA snoRNA binding activity, role in cleavage involved in rRNA processing, rRNA pseudouridine synthesis, snRNA pseudouridine synthesis and box H/ACA snoRNP complex, nucleolus localization	-0.962	1.921e-03	-1.536	1.690e-03	0.539	1.560e-03	-0.651	7.820e-02	-1.181	-2.092	1.165	-1.248	0	-1	0	0	NHP2	METABOLISM	RIBOSOMAL BIOGENESIS	F1	CAGL0J09614g	OFF	0	DOWN	0	0
CAGL0J09724g		Ortholog(s) have structural constituent of ribosome activity and mitochondrial large ribosomal subunit localization	-0.711	6.740e-04	-0.161	4.015e-01	-0.127	2.604e-01	1.231	3.593e-04	-0.888	-0.286	-0.48	2.044	0	0	0	1	MRPL11	METABOLISM	MITOCHONDRIAL BIOGENESIS	F1	CAGL0J09724g	OFF	0	0	0	UP
CAGL0J09812g	TPS1	Ortholog(s) have alpha,alpha-trehalose-phosphate synthase (UDP-forming) activity, trehalose-phosphatase activity	2.153	9.273e-05	0.916	9.159e-04	0.056	7.353e-01	-0.246	2.743e-01	2.458	1.13	-0.03	-0.538	1	0	0	0	TPS1	REDOX SIGNALING	METABOLISM	F3	CAGL0J09812g	OFF	UP	0	0	0
CAGL0J09944g	AQR1	Plasma membrane drug:H+ antiporter involved in resistance to drugs and acetic acid	-0.523	7.190e-03	-0.039	8.954e-01	1.248	2.176e-04	2.485	3.392e-05	-0.668	-0.124	2.917	4.239	0	0	1	1	AQR1	TRANSPORT / TRAFFICKING	PLASMA MEMBRANE	F4	CAGL0J09944g	OFF	0	0	UP	UP
CAGL0J10010g		Ortholog(s) have tRNA (adenine-N1-)-methyltransferase activity, role in tRNA methylation and nucleus, tRNA (m1A) methyltransferase complex localization	-1.751	5.107e-05	-1.521	1.147e-04	0.03	8.779e-01	-0.402	1.388e-01	-2.103	-2.073	-0.094	-0.811	-1	-1	0	0	GCD10	METABOLISM	NUCLEIC ACID METABOLISM	F1	CAGL0J10010g	OFF	DOWN	DOWN	0	0
CAGL0J10164g	RPL16A	Putative ribosomal protein	-1.98	3.065e-04	-1.494	1.123e-04	-0.388	1.399e-02	-1.281	1.845e-04	-2.37	-2.036	-1.126	-2.35	-1	-1	0	-1	RPL16B	METABOLISM	RIBOSOMAL BIOGENESIS	F1	CAGL0J10164g	Type II	DOWN	DOWN	0	DOWN
CAGL0J10362g		Ortholog(s) have 5'-deoxynucleotidase activity, GMP 5'-nucleotidase activity and role in deoxyribonucleoside monophosphate catabolic process	-1.944	1.814e-05	-1.707	1.338e-05	-0.002	9.892e-01	-1.064	5.298e-04	-2.327	-2.317	-0.172	-1.97	-1	-1	0	0	YGL101W	UNCLASSIFIED	_	Others	CAGL0J10362g	Type II	DOWN	DOWN	0	DOWN
CAGL0J10824g		Ortholog(s) have lanosterol synthase activity, role in ergosterol biosynthetic process and lipid droplet localization	0.467	9.389e-03	-0.02	9.333e-01	-0.224	1.221e-01	-1.217	2.456e-04	0.488	-0.1	-0.722	-2.237	0	0	0	-1	ERG7	METABOLISM	FATTY ACID AND LIPIDS	F1	CAGL0J10824g	OFF	0	0	0	DOWN
CAGL0J10846g		Ortholog(s) have cyclin-dependent protein serine/threonine kinase regulator activity	-0.236	5.681e-01	-0.037	8.954e-01	1.179	1.819e-04	0.614	1.581e-02	-0.333	-0.122	2.744	0.965	0	0	1	0	PCL5	REGULATION	OTHERS	F2	CAGL0J10846g	OFF	0	0	UP	0
CAGL0J10978g		Ortholog(s) have GTPase activator activity, Rho GTPase binding, phosphatidylinositol-4,5-bisphosphate binding activity	-0.547	2.698e-03	-0.214	2.725e-01	0.437	1.665e-02	1.416	1.036e-04	-0.695	-0.354	0.912	2.368	0	0	0	1	GIC2	REGULATION	OTHERS	F2	CAGL0J10978g	OFF	0	0	0	UP
CAGL0J11132g		Ortholog(s) have role in pheromone-dependent signal transduction involved in conjugation with cellular fusion and membrane raft, plasma membrane localization	0.466	1.253e-02	-0.901	1.668e-03	0.153	2.817e-01	1.458	4.354e-04	0.488	-1.257	0.21	2.441	0	0	0	1	MDG1	REGULATION	OTHERS	F2	CAGL0J11132g	OFF	0	0	0	UP
CAGL0J11682g		Ortholog(s) have role in aerobic respiration, development of symbiont in host and mitochondrial intermembrane space localization	-2.149	6.954e-06	-1.365	1.297e-04	0.458	1.630e-02	0.528	8.437e-02	-2.567	-1.868	0.963	0.816	-1	0	0	0	MIX17	REDOX SIGNALING	THIOL REDOX	F3	CAGL0J11682g	OFF	DOWN	DOWN	0	0
CAGL0J11792g		Has domain(s) with predicted RNA polymerase I CORE element sequence-specific DNA binding, RNA polymerase I general transcription initiation factor activity and role in transcription initiation from RNA polymerase I promoter	-0.843	2.747e-04	-0.364	7.690e-02	0.908	3.756e-04	0.783	3.658e-03	-1.042	-0.552	2.075	1.261	0	0	1	0		REGULATION	TRANSLATION	F2	CAGL0J11792g	OFF	0	0	UP	0
CAGL0J11858g	RML2	Ortholog(s) have structural constituent of ribosome activity, role in mitochondrial translation and mitochondrial large ribosomal subunit localization	-0.906	3.123e-04	-0.302	1.187e-01	-0.258	8.498e-02	1.536	2.003e-03	-1.115	-0.471	-0.805	2.578	0	0	0	1	RML2	METABOLISM	MITOCHONDRIAL BIOGENESIS	F1	CAGL0J11858g	OFF	0	0	0	UP
CAGL0K00110g	AWP2	Putative adhesin; identified in cell wall extracts by mass spectrometry; belongs to adhesin cluster V; predicted GPI-anchor	1.168	5.157e-05	1.566	3.708e-05	0.549	1.171e-02	1.255	3.329e-04	1.308	1.985	1.188	2.087	0	0	0	1		UNCLASSIFIED	_	Others	CAGL0K00110g	Type II	0	UP	0	UP
CAGL0K00715g	RTA1	Putative protein involved in 7-aminocholesterol resistance; gene is upregulated in azole-resistant strain	-1.486	1.522e-05	-1.275	2.766e-04	0.967	4.958e-05	0.119	6.378e-01	-1.792	-1.749	2.222	0.1	0	0	1	0	RTA1	TRANSPORT / TRAFFICKING	INTRACELLULAR TRANSPORT	F4	CAGL0K00715g	Type I	DOWN	DOWN	UP	0
CAGL0K00847g	CIR1	Protein of unknown function	-0.077	6.645e-01	0.556	6.551e-02	0.271	8.253e-02	1.339	6.645e-03	-0.147	0.657	0.502	2.234	0	0	0	1		REDOX SIGNALING	RESPIRATORY CHAIN	F3	CAGL0K00847g	OFF	0	0	0	UP
CAGL0K00869g		Has domain(s) with predicted ubiquitin binding activity, role in endosome transport via multivesicular body sorting pathway and ESCRT I complex localization	0.973	2.214e-04	0.415	9.140e-02	1.026	1.807e-04	1.847	9.266e-05	1.08	0.473	2.367	3.122	0	0	1	1		REGULATION	OTHERS	F2	CAGL0K00869g	OFF	0	0	UP	UP
CAGL0K01177g		Ortholog(s) have tubulin binding activity, role in tubulin complex assembly and cytoplasm, polysome, prefoldin complex localization	-0.484	6.174e-03	0.153	6.538e-01	-1	1.445e-04	-0.898	2.164e-02	-0.622	0.128	-2.638	-1.68	0	0	-1	0	PAC10	UNCLASSIFIED	_	Others	CAGL0K01177g	OFF	0	0	DOWN	0
CAGL0K01749g		Ortholog(s) have lipid binding, sterol transfer activity and role in ER to Golgi ceramide transport, endocytosis, exocytosis, maintenance of cell polarity, piecemeal microautophagy of the nucleus, sterol transport	0.931	2.521e-04	0.384	1.902e-01	1.232	3.381e-05	1.442	1.266e-03	1.031	0.431	2.875	2.414	0	0	1	1	OSH2	TRANSPORT / TRAFFICKING	INTRACELLULAR TRANSPORT	F4	CAGL0K01749g	OFF	0	0	UP	UP
CAGL0K01771g		Has domain(s) with predicted transferase activity, transferring acyl groups activity	-0.512	1.137e-01	1.972	2.303e-05	-0.959	1.130e-02	-1.226	6.690e-04	-0.655	2.519	-2.537	-2.252	0	1	-1	-1		UNCLASSIFIED	_	Others	CAGL0K01771g	Type I	0	UP	0	DOWN
CAGL0K01859g		Ortholog(s) have histone-glutamine methyltransferase activity, mRNA binding, rRNA methyltransferase activity and role in box C/D snoRNA 3'-end processing, histone glutamine methylation, rRNA methylation, rRNA processing, snoRNA processing	-1.693	1.159e-04	-1.546	5.556e-05	-0.321	2.994e-02	-1.665	4.049e-05	-2.034	-2.106	-0.96	-3.021	-1	-1	0	-1	NOP1	REGULATION	TRANSLATION	F2	CAGL0K01859g	Type II	DOWN	DOWN	0	DOWN
CAGL0K02233g		Ortholog(s) have role in maturation of 5.8S rRNA from tricistronic rRNA transcript (SSU-rRNA, 5.8S rRNA, LSU-rRNA), maturation of LSU-rRNA from tricistronic rRNA transcript (SSU-rRNA, 5.8S rRNA and LSU-rRNA), more	-1.767	5.342e-05	-0.815	2.373e-03	-0.017	9.359e-01	-0.044	8.947e-01	-2.121	-1.145	-0.21	-0.186	-1	0	0	0	NSA2	METABOLISM	RIBOSOMAL BIOGENESIS	F1	CAGL0K02233g	OFF	DOWN	0	0	0
CAGL0K02409g		Ortholog(s) have proton-transporting ATP synthase activity, rotational mechanism activity and role in ATP synthesis coupled proton transport, cristae formation, protein complex oligomerization	-1.871	9.896e-05	-1.075	1.197e-03	0.184	4.180e-01	1.574	1.883e-04	-2.243	-1.486	0.287	2.645	-1	0	0	1	ATP20	MEMBRANE / CELL WALL	_	Others	CAGL0K02409g	Type I	DOWN	0	0	UP
CAGL0K02629g		Ortholog(s) have intracellular localization	1.777	1.123e-05	1.658	2.735e-05	1.203	8.973e-05	0.453	1.183e-01	2.019	2.105	2.806	0.684	1	1	1	0		REDOX SIGNALING	UNKNOWN	F3	CAGL0K02629g	Type II	UP	UP	UP	0
CAGL0K02893g		Ortholog(s) have ubiquinol-cytochrome-c reductase activity, role in aerobic respiration, mitochondrial electron transport, ubiquinol to cytochrome c and mitochondrial respiratory chain complex III localization	-1.353	3.357e-04	-1.256	4.658e-04	0.974	6.791e-05	0.439	2.804e-01	-1.637	-1.724	2.238	0.66	0	0	1	0	QCR10	REDOX SIGNALING	RESPIRATORY CHAIN	F3	CAGL0K02893g	Type I	DOWN	DOWN	UP	0
CAGL0K03091g		Ortholog(s) have role in hydrogen peroxide-mediated programmed cell death	-0.683	2.022e-03	-0.192	3.339e-01	-0.562	2.815e-03	-1.29	4.354e-04	-0.854	-0.326	-1.556	-2.366	0	0	0	-1	YMR074C	UNCLASSIFIED	_	Others	CAGL0K03091g	OFF	0	0	DOWN	DOWN
CAGL0K03421g		Ortholog(s) have phosphoglucomutase activity	3.583	4.115e-05	0.833	2.432e-03	0.23	1.499e-01	-1.222	4.050e-04	4.129	1.022	0.402	-2.247	1	0	0	-1	PGM2	REDOX SIGNALING	METABOLISM	F3	CAGL0K03421g	Type I	UP	0	0	DOWN
CAGL0K03459g		Ortholog of S. cerevisiae : SPG4 and Saccharomyces cerevisiae S288C : YMR107W	2.072	1.099e-04	2.888	2.482e-05	0.977	4.189e-03	1.392	3.230e-03	2.363	3.723	2.247	2.327	1	1	1	1	SPG4	UNCLASSIFIED	_	Others	CAGL0K03459g	Type II	UP	UP	UP	UP
CAGL0K04103g		Ortholog(s) have dolichyldiphosphatase activity, role in lipid biosynthetic process, protein N-linked glycosylation and integral component of endoplasmic reticulum membrane localization	-0.98	8.915e-04	-0.076	8.232e-01	-0.943	4.508e-04	-0.342	3.014e-01	-1.201	-0.173	-2.498	-0.706	0	0	-1	0	CAX4	METABOLISM	FATTY ACID AND LIPIDS	F1	CAGL0K04103g	OFF	0	0	DOWN	0
CAGL0K04279g	SCM4	Ortholog of S. cerevisiae : SCM4 and Saccharomyces cerevisiae S288C : YGR049W	-1.531	6.964e-04	-2.29	5.634e-05	-1.561	1.101e-04	-1.948	2.126e-04	-1.845	-3.083	-4.023	-3.516	0	-1	-1	-1	SCM4	METABOLISM	MITOCHONDRIAL BIOGENESIS	F1	CAGL0K04279g	Type II	DOWN	DOWN	DOWN	DOWN
CAGL0K04301g		Putative mitochondrial Ser/Thr protein kinase; gene is upregulated in azole-resistant strain	2.756	8.828e-06	1.352	2.997e-04	0.311	1.981e-01	0.331	1.685e-01	3.163	1.703	0.601	0.47	1	0	0	0	FMP48	METABOLISM	UNKNOWN	F1	CAGL0K04301g	OFF	UP	UP	0	0
CAGL0K04367g		Ortholog(s) have L-methionine secondary active transmembrane transporter activity, role in methionine import across plasma membrane, sulfur amino acid transport and plasma membrane localization	0.992	3.782e-03	1.996	1.175e-05	0.046	7.160e-01	-0.521	5.705e-02	1.102	2.55	-0.054	-1.019	0	1	0	0	MUP1	TRANSPORT / TRAFFICKING	PLASMA MEMBRANE	F4	CAGL0K04367g	OFF	0	UP	0	0
CAGL0K04499g		Ortholog(s) have phosphoribosylformylglycinamidine synthase activity and role in purine nucleotide biosynthetic process	-0.697	2.816e-02	-0.372	3.593e-01	1.175	1.237e-03	0.13	7.267e-01	-0.871	-0.562	2.735	0.119	0	0	1	0	ADE6	METABOLISM	NUCLEIC ACID METABOLISM	F1	CAGL0K04499g	OFF	0	0	UP	0
CAGL0K04719g		Ortholog of S. cerevisiae : YNL208W, C. albicans SC5314 : C3_05710W_A/RCT1, C. dubliniensis CD36 : Cd36_85650, C. parapsilosis CDC317 : CPAR2_807040 and C. auris B8441 : B9J08_002643	1.308	5.467e-04	-0.427	3.385e-02	1.039	9.355e-04	0.336	1.179e-01	1.472	-0.635	2.4	0.48	0	0	1	0	YNL208W	UNCLASSIFIED	_	Others	CAGL0K04719g	OFF	0	0	UP	0
CAGL0K04851g	PEX17	Ortholog(s) have role in protein import into peroxisome matrix, docking and Pex17p-Pex14p docking complex, peroxisomal importomer complex, peroxisomal membrane localization	0.726	5.015e-04	0.177	4.166e-01	0.584	1.579e-03	1.784	1.711e-04	0.792	0.159	1.274	3.013	0	0	0	1	PEX17	TRANSPORT / TRAFFICKING	PEROXISOME	F4	CAGL0K04851g	OFF	0	0	0	UP
CAGL0K05137g		Ortholog(s) have alpha,alpha-trehalase activity and role in cellular response to desiccation, cellular response to ethanol, cellular response to freezing, pathogenesis, trehalose catabolic process	5.651	1.647e-07	6.441	1.775e-07	0.253	6.967e-02	-0.382	3.374e-01	6.545	8.393	0.458	-0.776	1	1	0	0	ATH1	REDOX SIGNALING	METABOLISM	F3	CAGL0K05137g	OFF	UP	UP	0	0
CAGL0K05247g		Ortholog(s) have ubiquitin protein ligase binding activity, role in fungal-type cell wall organization, regulation of transcription by RNA polymerase II and nucleus localization	1.316	1.055e-03	-0.053	8.189e-01	0.882	3.212e-04	0.006	9.792e-01	1.481	-0.144	2.012	-0.098	0	0	1	0	CSR2	REGULATION	PROTEIN DEGRADATION	F2	CAGL0K05247g	OFF	0	0	UP	0
CAGL0K05357g	GLN1	Ortholog(s) have glutamate-ammonia ligase activity, role in ammonia assimilation cycle, glutamine biosynthetic process, nitrogen compound metabolic process and nuclear periphery localization	-0.372	1.220e-01	1.915	2.671e-05	0.08	6.293e-01	2.149	8.573e-06	-0.491	2.444	0.03	3.651	0	1	0	1	GLN1	METABOLISM	NITROGEN METABOLISM	F1	CAGL0K05357g	Type II	0	UP	0	UP
CAGL0K05687g		Has domain(s) with predicted FMN binding, catalytic activity, oxidoreductase activity and role in oxidation-reduction process	1.529	1.481e-02	1.347	8.452e-04	0.891	4.807e-04	0.852	6.426e-03	1.729	1.698	2.033	1.382	0	0	1	0		REDOX SIGNALING	FLAVO HEMO PROTEIN	F3	CAGL0K05687g	Type II	0	UP	UP	0
CAGL0K05753g		Ortholog(s) have L-proline transmembrane transporter activity, amino acid transmembrane transporter activity and role in amino acid transport, transmembrane transport	-0.79	3.332e-02	0.41	1.127e-01	-0.238	3.098e-01	1.31	5.373e-04	-0.98	0.466	-0.756	2.183	0	0	0	1	GNP1	TRANSPORT / TRAFFICKING	PLASMA MEMBRANE	F4	CAGL0K05753g	OFF	0	0	0	UP
CAGL0K05813g		Ortholog(s) have disulfide oxidoreductase activity, glutathione disulfide oxidoreductase activity, glutathione peroxidase activity, glutathione transferase activity	2.406	3.908e-06	1.628	3.957e-05	0.566	3.287e-03	0.12	7.238e-01	2.754	2.067	1.23	0.102	1	1	0	0	GRX2	REDOX SIGNALING	THIOL REDOX	F3	CAGL0K05813g	OFF	UP	UP	0	0
CAGL0K06061g		Ortholog(s) have structural constituent of ribosome activity	-1.625	4.087e-04	-1.239	8.461e-05	-0.142	3.793e-01	-1.201	2.717e-04	-1.956	-1.702	-0.517	-2.209	0	0	0	-1	RPS28B	REGULATION	TRANSLATION	F2	CAGL0K06061g	Type II	DOWN	DOWN	0	DOWN
CAGL0K06105g		Ortholog of S. cerevisiae : BOP2 and Saccharomyces cerevisiae S288C : YLR267W	1.324	3.206e-04	0.925	1.291e-03	2.254	2.473e-06	1.668	2.930e-05	1.49	1.143	5.402	2.809	0	0	1	1	BOP2	UNCLASSIFIED	_	Others	CAGL0K06105g	OFF	0	0	UP	UP
CAGL0K06259g	TSA1	Thiol-specific antioxidant protein; predicted thioredoxin peroxidase involved in oxidative stress response; protein abundance decreased in ace2 mutant cells	0.117	7.789e-01	1.8	2.007e-03	-1.131	4.559e-04	-2.703	1.397e-04	0.08	2.292	-2.961	-4.837	0	1	-1	-1	TSA2	REDOX SIGNALING	THIOL REDOX	F3	CAGL0K06259g	Type I	0	UP	DOWN	DOWN
CAGL0K06567g		Ortholog(s) have preribosome, large subunit precursor localization	-1.765	3.528e-05	-1.546	3.119e-05	-0.032	8.215e-01	-1.308	2.332e-04	-2.119	-2.105	-0.247	-2.396	-1	-1	0	-1	RPL27B	METABOLISM	RIBOSOMAL BIOGENESIS	F1	CAGL0K06567g	Type II	DOWN	DOWN	0	DOWN
CAGL0K06633g		Ortholog(s) have role in attachment of spindle microtubules to kinetochore, protein localization to kinetochore and COMA complex, kinetochore localization	-0.301	7.070e-02	-0.512	2.029e-02	-0.864	2.853e-04	-0.811	4.388e-03	-0.408	-0.746	-2.303	-1.526	0	0	-1	0	AME1	UNCLASSIFIED	_	Others	CAGL0K06633g	OFF	0	0	DOWN	DOWN
CAGL0K06677g	MET8	Putative bifunctional dehydrogenase and ferrochelatase; gene is upregulated in azole-resistant strain	0.666	9.674e-03	1.782	2.339e-05	0.914	6.059e-04	1.279	2.464e-04	0.721	2.268	2.09	2.129	0	1	1	1	MET8	IRON-SULFUR CLUSTER SYNTHESIS AND ASSEMBLY	_	F5	CAGL0K06677g	Type II	0	UP	UP	UP
CAGL0K07111g		Ortholog(s) have microtubule binding, microtubule plus-end binding activity	-0.066	6.418e-01	0.059	7.964e-01	-0.221	9.235e-02	1.516	2.420e-03	-0.134	0.005	-0.713	2.543	0	0	0	1	DAD3	REGULATION	OTHERS	F2	CAGL0K07111g	OFF	0	0	0	UP
CAGL0K07183g		Protein of unknown function	0.353	3.941e-02	0.914	1.500e-02	0.9	2.160e-04	2.525	7.678e-04	0.356	1.127	2.056	4.308	0	0	1	1		UNCLASSIFIED	_	Others	CAGL0K07183g	OFF	0	0	UP	UP
CAGL0K07205g		Protein of unknown function	-1.763	2.738e-04	-0.287	2.791e-01	0.549	4.476e-02	-0.956	2.549e-03	-2.116	-0.451	1.189	-1.781	-1	0	0	0		UNCLASSIFIED	_	Others	CAGL0K07205g	Type II	DOWN	0	0	DOWN
CAGL0K07436g		Ortholog(s) have DNA binding, tricarboxylate secondary active transmembrane transporter activity	-0.419	1.369e-02	0.601	7.580e-03	0.078	4.735e-01	1.207	3.201e-04	-0.546	0.716	0.024	2.003	0	0	0	1	YHM2	TRANSPORT / TRAFFICKING	MITOCHONDRIA	F4	CAGL0K07436g	OFF	0	0	0	UP
CAGL0K07480g	PGM1	Putative phosphoglucomutase	2.195	8.062e-05	-0.385	9.323e-02	0.237	1.184e-01	-0.288	1.913e-01	2.507	-0.58	0.419	-0.613	1	0	0	0	PGM1	REDOX SIGNALING	METABOLISM	F3	CAGL0K07480g	OFF	UP	0	0	0
CAGL0K07546g	PMU2	Phosphate starvation inducible acid phosphatase; contains a phosphomutase-like domain; functionally complements a S. cerevisiae pho5 mutant; transcript abundance during phosphate starvation regulated by Pho4p	0.406	8.292e-02	0.968	4.055e-03	0.948	2.325e-04	5.706	1.843e-09	0.418	1.199	2.175	9.874	0	0	1	1		UNCLASSIFIED	_	Others	CAGL0K07546g	OFF	0	0	UP	UP
CAGL0K07590g	MYO3	Putative myosin	-0.019	8.945e-01	0.075	7.338e-01	-0.801	4.507e-02	-0.74	4.411e-03	-0.079	0.025	-2.148	-1.404	0	0	-1	0	MYO3	REGULATION	UNKNOWN	F2	CAGL0K07590g	NO	0	0	0	0
CAGL0K07678g		Protein of unknown function	4.803	2.107e-07	3.726	1.334e-07	0.505	1.633e-02	0.636	1.606e-02	5.555	4.825	1.08	1.003	1	1	0	0		UNCLASSIFIED	_	Others	CAGL0K07678g	OFF	UP	UP	0	0
CAGL0K08184g	CCP1	Cytochrome C peroxidase	-2.936	2.754e-06	-3.062	7.815e-07	0.189	8.130e-02	0.637	1.733e-02	-3.487	-4.098	0.299	1.006	-1	-1	0	0		REDOX SIGNALING	ROS DETOXIFICATION	F3	CAGL0K08184g	OFF	DOWN	DOWN	0	0
CAGL0K08206g		Protein of unknown function	0.967	1.475e-03	0.107	6.348e-01	0.533	1.787e-03	1.751	3.035e-05	1.073	0.068	1.149	2.955	0	0	0	1		TRANSPORT / TRAFFICKING	UNKNOWN	F4	CAGL0K08206g	OFF	0	0	0	UP
CAGL0K08338g		Protein of unknown function	-0.719	1.534e-03	-1.912	4.011e-05	0.847	3.411e-04	0.037	8.981e-01	-0.897	-2.586	1.926	-0.044	0	-1	0	0		UNCLASSIFIED	_	Others	CAGL0K08338g	Type I	0	DOWN	UP	0
CAGL0K08536g	APE1	Vacuolar aminopeptidase I	4.114	1.985e-06	2.645	3.943e-06	-0.152	2.817e-01	-0.378	1.313e-01	4.749	3.403	-0.544	-0.77	1	1	0	0	APE1	METABOLISM	PROTEIN DEGRADATION	F1	CAGL0K08536g	OFF	UP	UP	0	0
CAGL0K08668g	MET28	bZIP domain-containing protein	0.748	1.441e-01	2.211	1.356e-03	1.47	4.283e-03	0.946	1.426e-01	0.817	2.832	3.466	1.546	0	1	1	0	MET28	REGULATION	TRANSCRIPTIONAL REGULATOR	F2	CAGL0K08668g	Type II	0	UP	UP	0
CAGL0K08756g	AP5	bZIP domain-containing protein	3.797	2.107e-07	3.631	1.775e-07	-0.925	2.447e-04	-0.295	1.833e-01	4.378	4.7	-2.453	-0.625	1	1	-1	0	YAP5	REGULATION	TRANSCRIPTIONAL REGULATOR	F2	CAGL0K08756g	Type I	UP	UP	DOWN	0
CAGL0K09042g		Ortholog of S. cerevisiae : TMA16, C. albicans SC5314 : C1_09330W_A, C. dubliniensis CD36 : Cd36_08800, C. parapsilosis CDC317 : CPAR2_207530 and C. auris B8441 : B9J08_002306	-1.807	8.828e-06	-0.774	3.053e-03	-0.075	5.213e-01	-1.154	5.893e-04	-2.168	-1.09	-0.352	-2.127	-1	0	0	-1	TMA16	UNCLASSIFIED	_	Others	CAGL0K09042g	Type II	DOWN	0	0	DOWN
CAGL0K09372g		Ortholog(s) have DNA-binding transcription repressor activity, RNA polymerase II-specific, RNA polymerase II proximal promoter sequence-specific DNA binding activity	0.646	8.007e-03	0.345	1.439e-01	-0.791	2.022e-03	-0.563	2.878e-02	0.698	0.381	-2.121	-1.093	0	0	-1	0	MIG2	REGULATION	TRANSCRIPTIONAL REGULATOR	F2	CAGL0K09372g	OFF	0	0	DOWN	0
CAGL0K09702g		Putative stress-induced alcohol dehydrogenase; gene is upregulated in azole-resistant strain; protein differentially expressed in azole resistant strain	2.084	1.687e-06	2.565	1.147e-04	0.001	9.920e-01	0.762	5.618e-02	2.377	3.299	-0.164	1.224	1	1	0	0	YNL134C	REDOX SIGNALING	NAD(P)/NAD(P)H DEPENDANT ENZYME	F3	CAGL0K09702g	OFF	UP	UP	0	0
CAGL0K09724g	FPR1	Peptidyl-prolyl cis-trans isomerase; expression upregulated in biofilm vs planktonic cell culture	-0.685	1.132e-02	-0.887	7.715e-04	0.108	4.287e-01	-1.235	2.140e-04	-0.857	-1.24	0.1	-2.27	0	0	0	-1	FPR1	REGULATION	OTHERS	F2	CAGL0K09724g	OFF	0	0	0	DOWN
CAGL0K09988g		Ortholog(s) have role in vesicle-mediated transport and integral component of Golgi membrane localization	0.335	6.694e-02	0.38	8.893e-02	-0.903	7.354e-04	-0.278	2.808e-01	0.335	0.426	-2.398	-0.594	0	0	-1	0	TVP23	TRANSPORT / TRAFFICKING	ER/GOLGI TRANSPORT SYSTEM	F4	CAGL0K09988g	OFF	0	0	DOWN	0
CAGL0K10340g	ADE2	Putative phosphoribosylaminoimidazole carboxylase; aminoimidazole ribonucleotide (AIR) carboxylase	0.059	8.061e-01	0.32	1.122e-01	1.149	6.924e-04	0.149	6.048e-01	0.012	0.348	2.671	0.152	0	0	1	0	ADE2	METABOLISM	NUCLEIC ACID METABOLISM	F1	CAGL0K10340g	OFF	0	0	UP	0
CAGL0K10362g		Ortholog(s) have L-ornithine transmembrane transporter activity, role in arginine biosynthetic process, mitochondrial L-ornithine transmembrane transport and mitochondrial envelope localization	-2.752	7.835e-06	-0.97	6.244e-04	-0.43	2.274e-02	-0.766	5.772e-03	-3.272	-1.349	-1.23	-1.448	-1	0	0	0	ORT1	TRANSPORT / TRAFFICKING	MITOCHONDRIA	F4	CAGL0K10362g	OFF	DOWN	0	0	0
CAGL0K10428g		Ortholog(s) have enzyme inhibitor activity and role in negative regulation of glycogen catabolic process	0.488	1.915e-03	1.836	6.644e-06	0.163	2.320e-01	0.283	1.567e-01	0.513	2.341	0.234	0.387	0	1	0	0	IGD1	METABOLISM	ENERGY PRODUCTION (NON RESPIRATORY)	F1	CAGL0K10428g	OFF	0	UP	0	0
CAGL0K10736g	CYB2	Ortholog(s) have L-lactate dehydrogenase (cytochrome) activity and mitochondrial intermembrane space, mitochondrion localization	2.074	9.623e-06	1.633	1.649e-05	0.211	1.288e-01	-0.185	5.187e-01	2.366	2.073	0.354	-0.432	1	1	0	0	CYB2	REDOX SIGNALING	FLAVO HEMO PROTEIN	F3	CAGL0K10736g	OFF	UP	UP	0	0
