CAGL0E05148g		Ortholog(s) have alpha-mannosidase activity, role in mannose catabolic process, oligosaccharide catabolic process and Cvt complex, fungal-type vacuole membrane localization	2.378	2.521e-04	1.952	1.768e-04	0.163	1.167e-01	0.906	1.278e-02	2.721	2.492	0.236	1.476	1	1	0	0	METABOLISM	POST TRANSLATIONAL MODIFICATION	F1	CAGL0E05148g	OFF	UP	UP	0	0	CAGL0E05148g	YGL156W	S000003124	YGL156W	AMS1	Vacuolar alpha mannosidase; involved in free oligosaccharide (fOS) degradation; delivered to the vacuole in a novel pathway separate from the secretory pathway	4.194	4.030e-07	0.246	1.981e-01	0.017	9.999e-01	0.068	8.719e-01
CAGL0E05170g	GRE2(A)	Putative methylglyoxal reductase (NADPH-dependent)	1.856	1.776e-05	0.734	6.937e-03	0.784	1.675e-03	1.153	5.646e-04	2.111	0.891	1.771	1.909	1	0	0	0	REDOX SIGNALING	NAD(P)/NAD(P)H DEPENDANT ENZYME	F3	CAGL0E05170g	Type II	UP	0	UP	UP	CAGL0E05170g	YGL157W	S000003125	YGL157W	ARI1	NADPH-dependent aldehyde reductase; utilizes aromatic and alophatic aldehyde substrates; member of the short-chain dehydrogenase/reductase superfamily	2.601	2.800e-06	-0.663	3.318e-03	-0.107	9.999e-01	0.523	3.436e-01
CAGL0E05346g		Ortholog(s) have fungal-type vacuole membrane, vacuolar proton-transporting V-type ATPase, V1 domain localization	0.947	3.721e-04	1.501	3.118e-04	-0.458	9.216e-03	1.344	6.259e-03	1.05	1.9	-1.299	2.243	0	0	0	1	TRANSPORT / TRAFFICKING	VACUOLAR MEMBRANE	F4	CAGL0E05346g	Type II	0	UP	0	UP	CAGL0E05346g	YOR332W	S000005859	YOR332W	VMA4	Subunit E of the V1 domain of the vacuolar H+-ATPase (V-ATPase); V-ATPase is an electrogenic proton pump found throughout the endomembrane system; V1 domain has eight subunits; required for the V1 domain to assemble onto the vacuolar membrane; protein abundance increases in response to DNA replication stress	2.299	6.070e-05	-0.21	3.412e-01	-0.065	9.999e-01	0.249	5.119e-01
CAGL0E05456g		Ortholog of S. cerevisiae : YOR338W, C. albicans SC5314 : C2_09880C_A, C. dubliniensis CD36 : Cd36_23960, C. parapsilosis CDC317 : CPAR2_407140 and C. auris B8441 : B9J08_001012	0.605	2.567e-02	1.625	4.758e-05	1.042	4.060e-05	0.142	5.694e-01	0.65	2.062	2.407	0.14	0	1	1	0	REGULATION	OTHERS	F2	CAGL0E05456g	Type II	0	UP	UP	0	CAGL0E05456g	YOR338W	S000005865	YOR338W		Putative protein of unknown function; YOR338W transcription is regulated by Azf1p and its transcript is a specific target of the G protein effector Scp160p; identified as being required for sporulation in a high-throughput mutant screen; YOR338W has a paralog, FUN19, that arose from the whole genome duplication	0.099	6.140e-01	1.267	2.815e-04	-0.331	9.999e-01	0.17	7.481e-01
CAGL0E05500g		Ortholog(s) have RNA polymerase I activity, promoter-specific chromatin binding activity and role in nucleolar large rRNA transcription by RNA polymerase I, transcription by RNA polymerase I	-1.395	5.742e-04	-1.634	3.063e-04	0.155	5.102e-01	-0.414	1.642e-01	-1.687	-2.221	0.215	-0.832	0	-1	0	0	METABOLISM	NUCLEIC ACID METABOLISM	F1	CAGL0E05500g	OFF	DOWN	DOWN	0	0	CAGL0E05500g	YOR341W	S000005868	YOR341W	RPA190	RNA polymerase I largest subunit A190	-1.42	2.340e-04	-0.282	1.784e-01	-0.008	9.999e-01	0.038	9.430e-01
CAGL0E05588g		Ortholog(s) have DNA-directed DNA polymerase activity, deoxycytidyl transferase activity and role in error-free translesion synthesis, error-prone translesion synthesis	1.638	3.528e-05	1.81	5.054e-05	0.141	3.793e-01	-0.892	5.424e-03	1.856	2.306	0.181	-1.668	0	1	0	0	STRESS RESPONSE	_	Others	CAGL0E05588g	Type I	UP	UP	0	DOWN	CAGL0E05588g	YOR346W	S000005873	YOR346W	REV1	Deoxycytidyl transferase; involved in repair of abasic sites and adducted guanines in damaged DNA by translesion synthesis (TLS); forms a complex with the subunits of DNA polymerase zeta, Rev3p and Rev7p; relocalizes from nucleus to cytoplasm upon DNA replication stress	1.224	1.110e-04	0.858	2.814e-03	-0.01	9.999e-01	0.343	3.618e-01
CAGL0E05654g		Ortholog(s) have phosphatidylglycerol phospholipase C activity, role in cell-abiotic substrate adhesion, glycerophospholipid catabolic process, phosphatidylglycerol catabolic process and lipid droplet, mitochondrion localization	2.668	3.011e-06	0.145	5.292e-01	1.703	2.865e-05	1.285	4.009e-04	3.06	0.117	4.041	2.139	1	0	1	1	METABOLISM	FATTY ACID AND LIPIDS	F1	CAGL0E05654g	Type II	UP	0	UP	UP	CAGL0E05654g	YPL206C	S000006127	YPL206C	PGC1	Phosphatidylglycerol phospholipase C; regulates phosphatidylglycerol (PG) accumulation via a phospholipase C-type degradation mechanism; PG levels affect mitochondrial function; contains glycerophosphodiester phosphodiesterase motifs	0.122	5.040e-01	-0.255	1.459e-01	-0.028	9.999e-01	0.681	8.758e-02
CAGL0E05830g		Ortholog(s) have mRNA binding, ribosome binding activity and role in mitochondrial respiratory chain complex III assembly, positive regulation of mitochondrial translation	-0.81	7.435e-04	-0.293	1.530e-01	-0.093	4.274e-01	1.721	1.165e-03	-1.003	-0.458	-0.398	2.902	0	0	0	1	REGULATION	OTHERS	F2	CAGL0E05830g	OFF	0	0	0	UP	CAGL0E05830g	YPL215W	S000006136	YPL215W	CBP3	Mitochondrial protein required for assembly of cytochrome bc1 complex; forms a complex with Cbp6p that binds to mt ribosomes near the polypeptide tunnel exit and promotes efficient translation of the COB mRNA; Cbp3p-Cbp6p complex also interacts with newly synthesized cytochrome b (Cobp) and Cbp4p to promote assembly of Cobp into the cytochrome bc1 complex; Cbp3p-Cbp6p complex is sequestered if assembly of Complex III is blocked, downregulating COB mRNA translation	-1.461	2.890e-05	0.822	2.236e-03	0.077	9.999e-01	0.053	9.038e-01
CAGL0E06072g		Ortholog of S. cerevisiae : YMR181C and Saccharomyces cerevisiae S288C : YMR181C	2.009	1.127e-05	1.228	4.860e-04	-0.298	2.821e-02	0.764	1.862e-02	2.29	1.541	-0.905	1.227	1	0	0	0	UNCLASSIFIED	_	Others	CAGL0E06072g	OFF	UP	UP	0	0	CAGL0E06072g	YMR181C	S000004793	YMR181C		Protein of unknown function; mRNA transcribed as part of a bicistronic transcript with a predicted transcriptional repressor RGM1/YMR182C; mRNA is destroyed by nonsense-mediated decay (NMD); not an essential gene; YMR181C has a paralog, YPL229W, that arose from the whole genome duplication	1.826	3.540e-05	0.391	7.101e-02	-0.073	9.999e-01	-0.208	6.640e-01
CAGL0E06116g		Ortholog(s) have role in positive regulation of transcription by RNA polymerase II and cytosol, nuclear chromatin, nucleus localization	1.936	1.376e-05	0.394	5.250e-02	-1.108	3.381e-05	-0.378	6.287e-02	2.205	0.444	-2.905	-0.77	1	0	-1	0	REGULATION	TRANSCRIPTIONAL REGULATOR	F2	CAGL0E06116g	Type I	UP	0	DOWN	0	CAGL0E06116g	YMR182C	S000004794	YMR182C	RGM1	Putative zinc finger DNA binding transcription factor; contains two N-terminal C2H2 zinc fingers and C-terminal proline rich domain; overproduction impairs cell growth and induces expression of genes involved in monosaccharide catabolism and aldehyde metabolism; regulates expression of of Y' telomeric elements and subtelomeric COS genes; relocalizes to the cytosol in response to hypoxia; RGM1 has a paralog, USV1, that arose from the whole genome duplication	0.775	1.000e-03	0.304	1.182e-01	0.045	9.999e-01	0.538	1.219e-01
CAGL0E06138g		Ortholog(s) have fatty acid synthase activity, role in fatty acid biosynthetic process, long-chain fatty acid biosynthetic process, palmitic acid biosynthetic process and fatty acid synthase complex localization	0.783	6.331e-04	1.12	3.878e-04	-0.188	2.115e-01	-2.124	2.930e-05	0.858	1.399	-0.633	-3.824	0	0	0	-1	REDOX SIGNALING	PEROXISOME	F3	CAGL0E06138g	OFF	0	0	0	DOWN	CAGL0E06138g	YPL231W	S000006152	YPL231W	FAS2	Alpha subunit of fatty acid synthetase; complex catalyzes the synthesis of long-chain saturated fatty acids; contains the acyl-carrier protein domain and beta-ketoacyl reductase, beta-ketoacyl synthase and self-pantetheinylation activities	0.613	1.100e-01	0.874	3.110e-03	0.071	9.999e-01	-0.149	7.271e-01
CAGL0E06380g		Ortholog(s) have ATP-dependent NAD(P)H-hydrate dehydratase activity and role in nicotinamide nucleotide metabolic process	1.818	3.460e-05	0.35	8.102e-02	0.251	3.132e-02	0.135	4.995e-01	2.067	0.387	0.452	0.127	1	0	0	0	METABOLISM	OTHERS	F1	CAGL0E06380g	OFF	UP	0	0	0	CAGL0E06380g	YKL151C	S000001634	YKL151C	NNR2	Widely-conserved NADHX dehydratase; converts (S)-NADHX to NADH in ATP-dependent manner; YKL151C promoter contains STREs (stress response elements) and expression is induced by heat shock or methyl methanesulfonate; downstream intergenic region drives antisense expression and mediates coordinated regulation of YKL151C and GPM1 phosphoglycerate mutase; protein abundance increases in response to DNA replication stress; homolog of Carkd in mammals and C-terminus of YjeF in E.coli	3.235	2.030e-05	-0.214	4.979e-01	-0.033	9.999e-01	-0.026	9.708e-01
CAGL0E06424g		Ortholog(s) have cytochrome-b5 reductase activity, acting on NAD(P)H activity and role in cellular response to oxidative stress, ergosterol biosynthetic process	1.737	2.088e-05	1.025	2.998e-03	1.311	1.803e-05	1.373	1.678e-03	1.972	1.274	3.071	2.293	0	0	1	1	REDOX SIGNALING	NAD(P)/NAD(P)H DEPENDANT ENZYME	F3	CAGL0E06424g	Type II	UP	0	UP	UP	CAGL0E06424g	YKL150W	S000001633	YKL150W	MCR1	Mitochondrial NADH-cytochrome b5 reductase; involved in ergosterol biosynthesis	1.722	9.900e-05	-0.013	9.612e-01	0.118	9.999e-01	-0.072	8.999e-01
CAGL0F00187g	FET4	Has domain(s) with predicted role in transmembrane transport	2.351	1.608e-05	2.02	1.090e-05	-1.878	2.451e-05	-1.037	7.206e-04	2.689	2.582	-4.808	-1.922	1	1	-1	0	TRANSPORT / TRAFFICKING	PLASMA MEMBRANE	F4	CAGL0F00187g	Type I	UP	UP	DOWN	DOWN	CAGL0F00187g	YMR319C	S000004938	YMR319C	FET4	Low-affinity Fe(II) transporter of the plasma membrane	1.533	1.440e-04	-3.886	3.490e-06	0.031	9.999e-01	-0.397	2.366e-01
CAGL0F00209g		Has domain(s) with predicted role in transmembrane transport and integral component of plasma membrane localization	1.262	4.053e-03	0.342	3.326e-01	2.209	3.077e-05	1.612	4.799e-04	1.417	0.377	5.292	2.712	0	0	1	1	TRANSPORT / TRAFFICKING	PLASMA MEMBRANE	F4	CAGL0F00209g	OFF	0	0	UP	UP	CAGL0F00209g	YGR260W	S000003492	YGR260W	TNA1	High affinity nicotinic acid plasma membrane permease; responsible for uptake of low levels of nicotinic acid; expression of the gene increases in the absence of extracellular nicotinic acid or para-aminobenzoate (PABA)	-0.129	5.540e-01	0.322	2.354e-01	0.162	9.999e-01	0.704	4.408e-01
CAGL0F00231g		Ortholog(s) have inorganic phosphate transmembrane transporter activity, role in phosphate ion transmembrane transport and integral component of mitochondrial inner membrane, mitochondrion, plasma membrane localization	-0.991	2.797e-02	-1.853	9.425e-04	0.666	1.012e-01	1.677	1.165e-03	-1.215	-2.509	1.479	2.824	0	-1	0	1	TRANSPORT / TRAFFICKING	MITOCHONDRIA	F4	CAGL0F00231g	Type I	0	DOWN	0	UP	CAGL0F00231g	YJR077C	S000003838	YJR077C	MIR1	Mitochondrial phosphate carrier; imports inorganic phosphate into mitochondria; functionally redundant with Pic2p but more abundant than Pic2p under normal conditions; phosphorylated	-1.956	1.650e-05	1.138	2.180e-03	0.209	9.999e-01	0.225	6.116e-01
CAGL0F00407g		Ortholog(s) have deoxyhypusine monooxygenase activity	-2.763	6.954e-06	-2.623	5.829e-06	-0.19	2.896e-01	-0.944	6.333e-03	-3.284	-3.521	-0.637	-1.76	-1	-1	0	0	REDOX SIGNALING	METALLOENZYME	F3	CAGL0F00407g	Type II	DOWN	DOWN	0	DOWN	CAGL0F00407g	YJR070C	S000003831	YJR070C	LIA1	Deoxyhypusine hydroxylase; HEAT-repeat containing metalloenzyme that catalyzes hypusine formation; binds to and is required for the modification of Hyp2p (eIF5A); complements S. pombe mmd1 mutants defective in mitochondrial positioning; protein abundance increases in response to DNA replication stress	-2.149	4.280e-05	1.405	5.406e-04	0.061	9.999e-01	-0.011	9.835e-01
CAGL0F00429g		Ortholog(s) have GTP diphosphatase activity, ITP diphosphatase activity, UTP diphosphatase activity, XTP diphosphatase activity, dATP pyrophosphohydrolase activity and dCTP diphosphatase activity, more	-0.925	9.955e-04	-0.666	5.486e-03	-0.11	3.636e-01	-1.206	2.434e-04	-1.137	-0.948	-0.44	-2.218	0	0	0	-1	METABOLISM	NUCLEIC ACID METABOLISM	F1	CAGL0F00429g	OFF	0	0	0	DOWN	CAGL0F00429g	YJR069C	S000003830	YJR069C	HAM1	Nucleoside triphosphate pyrophosphohydrolase; active against various substrates including ITP, dITP and XTP; mediates exclusion of non canonical purines, pyrimidines from dNTP pools; functions with YJL055W to mediate resistance to 5-FU; specifically reduces the incorporation of 5-FU into RNA without affecting uptake or incorporation of uracil into RNA; protein abundance increases in response to DNA replication stress; yeast HAM1 can complement knockdown of human homolog ITPA	-1.342	2.690e-05	-0.198	2.013e-01	0.02	9.999e-01	0.066	8.426e-01
CAGL0F00605g	GLK1	Aldohexose specific glucokinase	1.9	4.688e-03	1.164	2.369e-03	-0.017	9.440e-01	1.954	7.223e-05	2.163	1.457	-0.209	3.31	1	0	0	1	REGULATION	OTHERS	F2	CAGL0F00605g	Type II	UP	0	0	UP	CAGL0F00605g	YDR516C	S000002924	YDR516C	EMI2	Non-essential protein of unknown function; required for transcriptional induction of the early meiotic-specific transcription factor IME1; required for sporulation; expression regulated by glucose-repression transcription factors Mig1/2p; EMI2 has a paralog, GLK1, that arose from the whole genome duplication; protein abundance increases in response to DNA replication stress	3.69	4.030e-07	-0.86	4.145e-03	0.022	9.999e-01	-0.337	3.335e-01
CAGL0F00649g		Has domain(s) with predicted ATP binding, protein kinase activity, protein tyrosine kinase activity and role in protein phosphorylation	0.055	8.416e-01	0.588	4.143e-02	-0.782	4.414e-03	-0.019	9.546e-01	0.008	0.7	-2.1	-0.142	0	0	-1	0	METABOLISM	POST TRANSLATIONAL MODIFICATION	F1	CAGL0F00649g	OFF	0	0	DOWN	0	CAGL0F00649g	YLR248W	S000004238	YLR248W	RCK2	Protein kinase involved in response to oxidative and osmotic stress; identified as suppressor of S. pombe cell cycle checkpoint mutations; similar to CaM (calmodulin) kinases; RCK2 has a paralog, RCK1, that arose from the whole genome duplication	0.542	2.090e-01	-1.506	1.673e-02	-0.459	9.999e-01	-1.269	1.522e-01
CAGL0F00715g		Protein of unknown function	2.79	7.621e-06	3.074	1.012e-06	-0.391	8.779e-02	-0.004	9.913e-01	3.203	3.968	-1.135	-0.116	1	1	0	0	METABOLISM	RIBOSOMAL BIOGENESIS	F1	CAGL0F00715g	OFF	UP	UP	0	0	CAGL0F00715g	YAL025C	S000000023	YAL025C	MAK16	Essential nuclear protein; constituent of 66S pre-ribosomal particles; required for maturation of 25S and 5.8S rRNAs; required for maintenance of M1 satellite double-stranded RNA of the L-A virus	1.248	9.460e-04	-0.461	1.817e-01	-0.169	9.999e-01	0.225	6.353e-01
CAGL0F01045g		Ortholog(s) have role in rRNA export from nucleus	-1.676	1.928e-04	-1.206	8.513e-04	-0.563	6.962e-03	-0.34	1.662e-01	-2.014	-1.659	-1.558	-0.704	-1	0	0	0	REGULATION	TRANSLATION	F2	CAGL0F01045g	Type II	DOWN	DOWN	DOWN	0	CAGL0F01045g	YOL040C	S000005400	YOL040C	RPS15	Protein component of the small (40S) ribosomal subunit; homologous to mammalian ribosomal protein S15 and bacterial S19	-1.219	5.840e-04	0.146	5.259e-01	-0.007	9.999e-01	-0.191	6.750e-01
CAGL0F01265g	YAP7	bZIP domain-containing protein involved in regulation of nitric oxide detoxification	0.038	7.735e-01	0.812	1.649e-02	-1.008	5.805e-05	-1.355	1.043e-03	-0.012	0.994	-2.658	-2.479	0	0	-1	-1	REGULATION	TRANSCRIPTIONAL REGULATOR	F2	CAGL0F01265g	OFF	0	0	DOWN	DOWN	CAGL0F01265g	YOL028C	S000005388	YOL028C	YAP7	Putative basic leucine zipper (bZIP) transcription factor; YAP7 has a paralog, YAP5, that arose from the whole genome duplication	0.487	6.860e-02	0.224	3.589e-01	-0.157	9.999e-01	-0.102	8.644e-01
CAGL0F01419g	AUS1	ATP-binding cassette transporter involved in sterol uptake	3.463	3.011e-06	2.953	3.298e-06	-0.922	2.094e-03	-2.151	2.984e-05	3.989	3.809	-2.445	-3.872	1	1	-1	-1	TRANSPORT / TRAFFICKING	PLASMA MEMBRANE	F4	CAGL0F01419g	Type I	UP	UP	DOWN	DOWN	CAGL0F01419g	YOR011W	S000005537	YOR011W	AUS1	Plasma membrane sterol transporter of the ATP-binding cassette family; required, along with Pdr11p, for uptake of exogenous sterols and their incorporation into the plasma membrane; activity is stimulated by phosphatidylserine; sterol uptake is required for anaerobic growth because sterol biosynthesis requires oxygen; AUS1 has a paralog, PDR11, that arose from the whole genome duplication	4.793	1.220e-06	-2.491	1.213e-04	-0.495	9.999e-01	-1.195	4.890e-02
CAGL0F01463g	TIR1	Putative GPI-linked cell wall mannoprotein of the Srp1p/Tip1p family	2.071	5.833e-05	0.435	1.746e-01	-0.074	8.188e-01	-1.043	5.129e-03	2.362	0.499	-0.35	-1.933	1	0	0	0	STRESS RESPONSE	_	Others	CAGL0F01463g	Type I	UP	0	0	DOWN	CAGL0F01463g	YOR010C	S000005536	YOR010C	TIR2	Putative cell wall mannoprotein; member of the Srp1p/Tip1p family of serine-alanine-rich proteins; transcription is induced by cold shock and anaerobiosis; TIR2 has a paralog, TIR3, that arose from the whole genome duplication	2.001	1.030e-04	-0.952	2.406e-02	-0.201	9.999e-01	-0.712	5.119e-01
CAGL0F01485g	TIR2	Putative GPI-linked cell wall mannoprotein of the Srp1p/Tip1p family	1.919	1.129e-04	1.415	1.297e-04	0.216	2.085e-01	0.051	8.382e-01	2.185	1.786	0.367	-0.02	1	0	0	0	MEMBRANE / CELL WALL	_	Others	CAGL0F01485g	OFF	UP	UP	0	0	CAGL0F01485g	YOR009W	S000005535	YOR009W	TIR4	Cell wall mannoprotein; expressed under anaerobic conditions and required for anaerobic growth; transcription is also induced by cold shock; member of the Srp1p/Tip1p family of serine-alanine-rich proteins	3.771	1.700e-05	-3.023	1.630e-04	-0.662	9.999e-01	-1.269	4.313e-01
CAGL0F01749g		Putative serine hydroxymethyltransferase; protein differentially expressed in azole resistant strain	-0.833	2.682e-02	1.2	1.816e-03	1.294	1.128e-02	0.205	5.682e-01	-1.03	1.504	3.03	0.251	0	0	1	0	METABOLISM	AMINO ACID METABOLISM	F1	CAGL0F01749g	OFF	0	UP	0	0	CAGL0F01749g	YLR058C	S000004048	YLR058C	SHM2	Cytosolic serine hydroxymethyltransferase; converts serine to glycine plus 5,10 methylenetetrahydrofolate; major isoform involved in generating precursors for purine, pyrimidine, amino acid, and lipid biosynthesis	-1.134	4.130e-04	-0.47	4.188e-02	0.078	9.999e-01	-0.224	5.230e-01
CAGL0F02101g		Ortholog(s) have peptidase activator activity, proteasome binding activity	1.897	1.824e-04	0.995	4.621e-04	0.126	4.320e-01	0.081	7.242e-01	2.159	1.235	0.144	0.032	1	0	0	0	REGULATION	PROTEIN DEGRADATION	F2	CAGL0F02101g	OFF	UP	0	0	0	CAGL0F02101g	YFL007W	S000001887	YFL007W	BLM10	Proteasome activator; binds the core proteasome (CP) and stimulates proteasome-mediated protein degradation by inducing gate opening; required for sequestering CP into proteasome storage granule (PSG) during quiescent phase and for nuclear import of CP in proliferating cells; required for resistance to bleomycin, may be involved in protecting against oxidative damage; similar to mammalian PA200	2.323	2.410e-06	-0.282	8.608e-02	-0.041	9.999e-01	0.383	5.730e-01
CAGL0F02145g	PHM1	Ortholog(s) have calmodulin binding activity and role in lysosomal microautophagy, polyphosphate metabolic process, protein localization, vacuolar transport, vacuole fusion, non-autophagic	0.472	9.741e-03	0.551	1.076e-02	0.346	8.827e-03	1.21	7.781e-04	0.495	0.651	0.687	2.008	0	0	0	1	MEMBRANE / CELL WALL	_	Others	CAGL0F02145g	OFF	0	0	0	UP	CAGL0F02145g	YFL004W	S000001890	YFL004W	VTC2	Regulatory subunit of the vacuolar transporter chaperone (VTC) complex; involved in membrane trafficking, vacuolar polyphosphate accumulation, microautophagy and non-autophagic vacuolar fusion; VTC2 has a paralog, VTC3, that arose from the whole genome duplication	1.249	4.480e-04	0.157	4.886e-01	0.104	9.999e-01	0.351	4.085e-01
CAGL0F02233g		Ortholog(s) have dipeptidase activity	-2.178	3.011e-06	-2.427	3.446e-06	-0.215	7.661e-02	-0.117	6.369e-01	-2.601	-3.264	-0.698	-0.313	-1	-1	0	0	METABOLISM	PROTEIN DEGRADATION	F1	CAGL0F02233g	OFF	DOWN	DOWN	0	0	CAGL0F02233g	YFR006W	S000001902	YFR006W		Putative X-Pro aminopeptidase; green fluorescent protein (GFP)-fusion protein localizes to the cytoplasm; YFR006W is not an essential gene	-0.372	3.000e-02	2.043	2.213e-05	-0.291	9.999e-01	0.138	6.806e-01
CAGL0F02431g	ACO2	Ortholog(s) have role in mitochondrial translation and cytoplasm, mitochondrion, nucleus localization	-2.034	3.078e-05	-2.576	4.316e-06	0.118	4.299e-01	-0.101	7.514e-01	-2.434	-3.459	0.124	-0.285	-1	-1	0	0	METABOLISM	ENERGY PRODUCTION (RESPIRATORY)	F1	CAGL0F02431g	OFF	DOWN	DOWN	0	0	CAGL0F02431g	YJL200C	S000003736	YJL200C	ACO2	Putative mitochondrial aconitase isozyme; similarity to Aco1p, an aconitase required for the TCA cycle; expression induced during growth on glucose, by amino acid starvation via Gcn4p, and repressed on ethanol	-1.128	1.560e-03	0.435	1.983e-01	-0.192	9.999e-01	-0.486	4.302e-01
CAGL0F02513g		Ortholog(s) have role in protein secretion	0.036	8.700e-01	-0.168	5.383e-01	0.557	4.086e-02	1.299	2.411e-03	-0.015	-0.294	1.209	2.164	0	0	0	1	TRANSPORT / TRAFFICKING	INTRACELLULAR TRANSPORT	F4	CAGL0F02513g	OFF	0	0	0	UP	CAGL0F02513g	YJL205C	S000003742	YJL205C	NCE101	Protein of unknown function; involved in secretion of proteins that lack classical secretory signal sequences; SWAT-GFP and mCherry fusion proteins localize to the cytosol	-1.213	5.990e-04	0.24	3.652e-01	0.057	9.999e-01	-0.735	3.281e-01
CAGL0F02563g	HPT1	Putative hypoxanthine guanine phosphoribosyl transferase	-2.116	1.376e-05	-1.496	5.749e-05	0.599	1.733e-03	-1.595	7.539e-05	-2.528	-2.04	1.313	-2.899	-1	-1	0	-1	METABOLISM	NUCLEIC ACID METABOLISM	F1	CAGL0F02563g	Type II	DOWN	DOWN	0	DOWN	CAGL0F02563g	YDR399W	S000002807	YDR399W	HPT1	Dimeric hypoxanthine-guanine phosphoribosyltransferase; catalyzes the transfer of the phosphoribosyl portion of 5-phosphoribosyl-alpha-1-pyrophosphate to a purine base (either guanine or hypoxanthine) to form pyrophosphate and a purine nucleotide (either guanosine monophosphate or inosine monophosphate); mutations in the human homolog HPRT1 can cause Lesch-Nyhan syndrome and Kelley-Seegmiller syndrome	-1.153	6.550e-04	-0.163	4.652e-01	0.132	9.999e-01	-0.198	6.689e-01
CAGL0F03399g	SCS7	Ortholog(s) have fatty acid alpha-hydroxylase activity, role in inositol phosphoceramide metabolic process, mannosyl-inositol phosphorylceramide metabolic process and membrane localization	-1.072	5.718e-03	-1.76	1.332e-04	-0.376	1.763e-02	1.109	3.230e-03	-1.309	-2.386	-1.096	1.831	0	-1	0	0	REDOX SIGNALING	PEROXISOME	F3	CAGL0F03399g	Type I	0	DOWN	0	UP	CAGL0F03399g	YMR272C	S000004885	YMR272C	SCS7	Sphingolipid alpha-hydroxylase; functions in the alpha-hydroxylation of sphingolipid-associated very long chain fatty acids, has both cytochrome b5-like and hydroxylase/desaturase domains, not essential for growth	-0.741	8.870e-03	1.392	6.582e-04	0.179	9.999e-01	0.556	3.966e-01
CAGL0F03553g	DAP1	Putative heme-binding protein involved in regulation of cytochrome P450, Erg11p; required for growth under iron starvation	0.22	3.231e-01	0.522	3.231e-02	-0.475	5.654e-02	-1.733	1.766e-04	0.201	0.613	-1.341	-3.14	0	0	0	-1	REGULATION	OTHERS	F2	CAGL0F03553g	OFF	0	0	0	DOWN	CAGL0F03553g	YPL170W	S000006091	YPL170W	DAP1	Heme-binding protein; involved in regulation of cytochrome P450 protein Erg11p; damage response protein, related to mammalian membrane progesterone receptors; mutations lead to defects in telomeres, mitochondria, and sterol synthesis	1.251	5.680e-04	0.734	1.729e-02	0.013	9.999e-01	-0.38	5.891e-01
CAGL0F03861g		Ortholog(s) have mevalonate kinase activity and role in ergosterol biosynthetic process, farnesyl diphosphate biosynthetic process, mevalonate pathway, isopentenyl diphosphate biosynthetic process, mevalonate pathway	-0.213	1.774e-01	-0.428	5.813e-02	-0.771	1.807e-04	-1.357	2.112e-04	-0.306	-0.635	-2.072	-2.483	0	0	-1	-1	IRON-SULFUR CLUSTER SYNTHESIS AND ASSEMBLY	_	F5	CAGL0F03861g	OFF	0	0	DOWN	DOWN	CAGL0F03861g	YMR208W	S000004821	YMR208W	ERG12	Mevalonate kinase; acts in the biosynthesis of isoprenoids and sterols, including ergosterol, from mevalonate; human MVK functionally complements the lethality of the erg12 null mutation	-0.814	2.670e-04	-0.162	2.708e-01	-0.049	9.999e-01	0.058	9.058e-01
CAGL0F03927g		Ortholog(s) have GMP synthase (glutamine-hydrolyzing) activity and role in GMP biosynthetic process, GMP metabolic process	-1.385	5.997e-04	-1.223	2.268e-04	-0.488	9.674e-03	-1.272	1.883e-04	-1.675	-1.681	-1.375	-2.334	0	0	0	-1	METABOLISM	NUCLEIC ACID METABOLISM	F1	CAGL0F03927g	Type II	DOWN	DOWN	0	DOWN	CAGL0F03927g	YMR217W	S000004830	YMR217W	GUA1	GMP synthase; highly conserved enzyme that catalyzes the second step in the biosynthesis of GMP from inosine 5'-phosphate (IMP); transcription is not subject to regulation by guanine but is negatively regulated by nutrient starvation; reduction-of-function mutation gua1-G388D causes changes in cellular guanine nucleotide pools, defects in general protein synthesis, and impaired translation of GCN4 mRNA	-1.45	9.240e-05	-0.096	6.284e-01	-0.158	9.999e-01	-0.099	7.978e-01
CAGL0F03993g	ERG8	Ortholog(s) have phosphomevalonate kinase activity	-0.499	2.875e-02	-0.808	2.892e-03	-0.667	2.448e-04	-1.128	4.482e-04	-0.64	-1.136	-1.816	-2.082	0	0	0	-1	IRON-SULFUR CLUSTER SYNTHESIS AND ASSEMBLY	_	F5	CAGL0F03993g	OFF	0	0	DOWN	DOWN	CAGL0F03993g	YMR220W	S000004833	YMR220W	ERG8	Phosphomevalonate kinase; an essential cytosolic enzyme that acts in the biosynthesis of isoprenoids and sterols, including ergosterol, from mevalonate	-0.562	2.200e-03	-0.096	5.788e-01	-0.014	9.999e-01	-0.087	8.170e-01
CAGL0F04191g		Ortholog of S. cerevisiae : YBL029C-A, C. albicans SC5314 : C1_02060W_A, C. dubliniensis CD36 : Cd36_01920, C. parapsilosis CDC317 : CPAR2_108200 and C. auris B8441 : B9J08_000493	1.524	9.040e-05	0.371	1.075e-01	1.521	3.381e-05	0.68	3.506e-02	1.724	0.414	3.591	1.082	0	0	1	0	UNCLASSIFIED	_	Others	CAGL0F04191g	Type II	UP	0	UP	0	CAGL0F04191g	YBL029C-A	S000007591	YBL029C-A		Protein of unknown function; green fluorescent protein (GFP)-fusion protein localizes to the cell periphery; protein abundance increases in response to DNA replication stress; has potential orthologs in Saccharomyces species and in Yarrowia lipolytica	0.446	2.490e-02	0.178	3.671e-01	-0.069	9.999e-01	-0.185	7.072e-01
