CAGL0K04279g	SCM4	Ortholog of S. cerevisiae : SCM4 and Saccharomyces cerevisiae S288C : YGR049W	-1.531	6.964e-04	-2.29	5.634e-05	-1.56	1.101e-04	-1.948	2.126e-04	-1.845	-3.083	-4.023	-3.516	0	-1	-1	-1	METABOLISM	MITOCHONDRIAL BIOGENESIS	F1	CAGL0K04279g	Type II	DOWN	DOWN	DOWN	DOWN	CAGL0K04279g	YGR049W	S000003281	YGR049W	SCM4	Mitochondrial outer membrane protein of unknown function; predicted to have 4 transmembrane segments; import is mediated by Tom70p and Mim1p; interacts genetically with a cdc4 mutation; SCM4 has a paralog, ATG33, that arose from the whole genome duplication	-0.784	5.390e-03	1.992	1.050e-04	0.073	9.999e-01	0.213	5.499e-01
CAGL0K04301g		Putative mitochondrial Ser/Thr protein kinase; gene is upregulated in azole-resistant strain	2.756	8.828e-06	1.352	2.997e-04	0.311	1.981e-01	0.331	1.685e-01	3.163	1.703	0.601	0.47	1	0	0	0	METABOLISM	UNKNOWN	F1	CAGL0K04301g	OFF	UP	UP	0	0	CAGL0K04301g	YGR052W	S000003284	YGR052W	FMP48	Putative protein of unknown function; the authentic, non-tagged protein is detected in highly purified mitochondria in high-throughput studies; induced by treatment with 8-methoxypsoralen and UVA irradiation	2.791	1.690e-04	-0.341	6.397e-01	0.023	9.999e-01	1.18	2.066e-01
CAGL0K04367g		Ortholog(s) have L-methionine secondary active transmembrane transporter activity, role in methionine import across plasma membrane, sulfur amino acid transport and plasma membrane localization	0.992	3.782e-03	1.996	1.175e-05	0.046	7.160e-01	-0.521	5.705e-02	1.102	2.55	-0.054	-1.019	0	1	0	0	TRANSPORT / TRAFFICKING	PLASMA MEMBRANE	F4	CAGL0K04367g	OFF	0	UP	0	0	CAGL0K04367g	YGR055W	S000003287	YGR055W	MUP1	High affinity methionine permease; integral membrane protein with 13 putative membrane-spanning regions; also involved in cysteine uptake	-0.019	9.250e-01	0.848	1.327e-03	-0.234	9.999e-01	0.432	2.704e-01
CAGL0K04499g		Ortholog(s) have phosphoribosylformylglycinamidine synthase activity and role in purine nucleotide biosynthetic process	-0.697	2.816e-02	-0.372	3.593e-01	1.175	1.237e-03	0.13	7.267e-01	-0.871	-0.562	2.735	0.119	0	0	1	0	METABOLISM	NUCLEIC ACID METABOLISM	F1	CAGL0K04499g	OFF	0	0	UP	0	CAGL0K04499g	YGR061C	S000003293	YGR061C	ADE6	Formylglycinamidine-ribonucleotide (FGAM)-synthetase; catalyzes a step in the 'de novo' purine nucleotide biosynthetic pathway	-0.985	2.510e-04	-0.392	5.135e-02	0.169	9.999e-01	-0.138	7.597e-01
CAGL0K04719g		Ortholog of S. cerevisiae : YNL208W, C. albicans SC5314 : C3_05710W_A/RCT1, C. dubliniensis CD36 : Cd36_85650, C. parapsilosis CDC317 : CPAR2_807040 and C. auris B8441 : B9J08_002643	1.308	5.467e-04	-0.427	3.385e-02	1.039	9.355e-04	0.336	1.179e-01	1.472	-0.635	2.4	0.48	0	0	1	0	UNCLASSIFIED	_	Others	CAGL0K04719g	OFF	0	0	UP	0	CAGL0K04719g	YNL208W	S000005152	YNL208W		Protein of unknown function; may interact with ribosomes, based on co-purification experiments; authentic, non-tagged protein is detected in purified mitochondria in high-throughput studies; potential orthologs found in other fungi	1.607	2.820e-04	0.85	1.794e-02	0.136	9.999e-01	-0.634	3.957e-01
CAGL0K04851g	PEX17	Ortholog(s) have role in protein import into peroxisome matrix, docking and Pex17p-Pex14p docking complex, peroxisomal importomer complex, peroxisomal membrane localization	0.726	5.015e-04	0.177	4.166e-01	0.584	1.579e-03	1.784	1.711e-04	0.792	0.159	1.274	3.013	0	0	0	1	TRANSPORT / TRAFFICKING	PEROXISOME	F4	CAGL0K04851g	OFF	0	0	0	UP	CAGL0K04851g	YNL214W	S000005158	YNL214W	PEX17	Membrane peroxin of the peroxisomal importomer complex; complex facilitates the import of peroxisomal matrix proteins; required for peroxisome biogenesis	0.991	1.930e-04	0.015	9.452e-01	-0.024	9.999e-01	-0.236	5.279e-01
CAGL0K05137g		Ortholog(s) have alpha,alpha-trehalase activity and role in cellular response to desiccation, cellular response to ethanol, cellular response to freezing, pathogenesis, trehalose catabolic process	5.651	1.647e-07	6.441	1.775e-07	0.253	6.967e-02	-0.382	3.374e-01	6.545	8.393	0.458	-0.776	1	1	0	0	REDOX SIGNALING	METABOLISM	F3	CAGL0K05137g	OFF	UP	UP	0	0	CAGL0K05137g	YPR026W	S000006230	YPR026W	ATH1	Acid trehalase required for utilization of extracellular trehalose; involved in intracellular trehalose degradation during growth recovery after saline stress	4.798	4.030e-07	-3.017	1.507e-05	-0.309	9.999e-01	-0.283	5.075e-01
CAGL0K05247g		Ortholog(s) have ubiquitin protein ligase binding activity, role in fungal-type cell wall organization, regulation of transcription by RNA polymerase II and nucleus localization	1.316	1.055e-03	-0.053	8.189e-01	0.882	3.212e-04	0.006	9.792e-01	1.481	-0.144	2.012	-0.098	0	0	1	0	REGULATION	PROTEIN DEGRADATION	F2	CAGL0K05247g	OFF	0	0	UP	0	CAGL0K05247g	YPR030W	S000006234	YPR030W	CSR2	Nuclear ubiquitin protein ligase binding protein; may regulate utilization of nonfermentable carbon sources and endocytosis of plasma membrane proteins; overproduction suppresses chs5 spa2 lethality at high temp; ubiquitinated by Rsp5p, deubiquitinated by Ubp2p; CSR2 has a paralog, ECM21, that arose from the whole genome duplication	3.922	2.940e-06	1.397	2.836e-04	0.027	9.999e-01	0.662	8.022e-02
CAGL0K05357g	GLN1	Ortholog(s) have glutamate-ammonia ligase activity, role in ammonia assimilation cycle, glutamine biosynthetic process, nitrogen compound metabolic process and nuclear periphery localization	-0.372	1.220e-01	1.915	2.671e-05	0.08	6.293e-01	2.149	8.573e-06	-0.491	2.444	0.03	3.651	0	1	0	1	METABOLISM	NITROGEN METABOLISM	F1	CAGL0K05357g	Type II	0	UP	0	UP	CAGL0K05357g	YPR035W	S000006239	YPR035W	GLN1	Glutamine synthetase (GS); synthesizes glutamine from glutamate and ammonia; with Glt1p, forms the secondary pathway for glutamate biosynthesis from ammonia; expression regulated by nitrogen source and by amino acid limitation; forms filaments of back-to-back stacks of cylindrical homo-decamers at low pH, leading to enzymatic inactivation and storage during states of advanced cellular starvation; relocalizes from nucleus to cytoplasmic foci upon DNA replication stress	-0.576	1.430e-02	0.551	7.336e-03	0.065	9.999e-01	0.007	9.900e-01
CAGL0K05687g		Has domain(s) with predicted FMN binding, catalytic activity, oxidoreductase activity and role in oxidation-reduction process	1.528	1.481e-02	1.347	8.452e-04	0.89	4.807e-04	0.852	6.426e-03	1.729	1.698	2.033	1.382	0	0	1	0	REDOX SIGNALING	FLAVO HEMO PROTEIN	F3	CAGL0K05687g	Type II	0	UP	UP	0	CAGL0K05687g	YHR179W	S000001222	YHR179W	OYE2	Conserved NADPH oxidoreductase containing flavin mononucleotide (FMN); responsible for geraniol reduction into citronellol during fermentation; homologous to Oye3p with different ligand binding and catalytic properties; may be involved in sterol metabolism, oxidative stress response, and programmed cell death; protein abundance increases in response to DNA replication stress	2.335	1.950e-05	0.396	1.402e-01	0.12	9.999e-01	0.125	8.103e-01
CAGL0K05753g		Ortholog(s) have L-proline transmembrane transporter activity, amino acid transmembrane transporter activity and role in amino acid transport, transmembrane transport	-0.79	3.332e-02	0.41	1.127e-01	-0.238	3.098e-01	1.31	5.373e-04	-0.98	0.466	-0.756	2.183	0	0	0	1	TRANSPORT / TRAFFICKING	PLASMA MEMBRANE	F4	CAGL0K05753g	OFF	0	0	0	UP	CAGL0K05753g	YDR508C	S000002916	YDR508C	GNP1	High-affinity glutamine permease; also transports Leu, Ser, Thr, Cys, Met and Asn; expression is fully dependent on Grr1p and modulated by the Ssy1p-Ptr3p-Ssy5p (SPS) sensor of extracellular amino acids; GNP1 has a paralog, AGP1, that arose from the whole genome duplication	-0.359	1.090e-01	0.671	1.883e-02	-0.198	9.999e-01	-0.244	7.162e-01
CAGL0K05813g		Ortholog(s) have disulfide oxidoreductase activity, glutathione disulfide oxidoreductase activity, glutathione peroxidase activity, glutathione transferase activity	2.406	3.908e-06	1.628	3.957e-05	0.566	3.287e-03	0.12	7.238e-01	2.754	2.067	1.23	0.102	1	1	0	0	REDOX SIGNALING	THIOL REDOX	F3	CAGL0K05813g	OFF	UP	UP	0	0	CAGL0K05813g	YDR513W	S000002921	YDR513W	GRX2	Cytoplasmic glutaredoxin; thioltransferase, glutathione-dependent disulfide oxidoreductase involved in maintaining redox state of target proteins, also exhibits glutathione peroxidase activity, expression induced in response to stress; GRX2 has two in-frame start codons resulting in a shorter isoform that is retained in the cytosol and a longer form translocated to the mitochondrial matrix; GRX2 has a paralog, GRX1, that arose from the whole genome duplication	1.666	7.080e-04	-1.243	1.261e-02	0.071	9.999e-01	-0.086	9.369e-01
CAGL0K06061g		Ortholog(s) have structural constituent of ribosome activity	-1.625	4.087e-04	-1.239	8.461e-05	-0.142	3.793e-01	-1.2	2.717e-04	-1.956	-1.702	-0.517	-2.209	0	0	0	-1	REGULATION	TRANSLATION	F2	CAGL0K06061g	Type II	DOWN	DOWN	0	DOWN	CAGL0K06061g	YLR264W	S000004254	YLR264W	RPS28B	Protein component of the small (40S) ribosomal subunit; homologous to mammalian ribosomal protein S28, no bacterial homolog; has an extraribosomal function in autoregulation, in which Rps28Bp binds to a decapping complex via Edc3p, which then binds to RPS28B mRNA leading to its decapping and degradation; RPS28B has a paralog, RPS28A, that arose from the whole genome duplication	-1.142	7.460e-04	0.258	3.661e-01	-0.122	9.999e-01	-0.382	6.116e-01
CAGL0K06105g		Ortholog of S. cerevisiae : BOP2 and Saccharomyces cerevisiae S288C : YLR267W	1.324	3.206e-04	0.925	1.291e-03	2.254	2.473e-06	1.668	2.930e-05	1.49	1.143	5.402	2.809	0	0	1	1	UNCLASSIFIED	_	Others	CAGL0K06105g	OFF	0	0	UP	UP	CAGL0K06105g	YLR267W	S000004257	YLR267W	BOP2	Protein of unknown function	3.068	1.870e-05	1.211	5.679e-03	-0.302	9.999e-01	0.693	4.063e-01
CAGL0K06259g	TSA1	Thiol-specific antioxidant protein; predicted thioredoxin peroxidase involved in oxidative stress response; protein abundance decreased in ace2 mutant cells	0.117	7.789e-01	1.8	2.007e-03	-1.131	4.559e-04	-2.703	1.397e-04	0.08	2.292	-2.961	-4.837	0	1	-1	-1	REDOX SIGNALING	THIOL REDOX	F3	CAGL0K06259g	Type I	0	UP	DOWN	DOWN	CAGL0K06259g	YDR453C	S000002861	YDR453C	TSA2	Stress inducible cytoplasmic thioredoxin peroxidase; cooperates with Tsa1p in the removal of reactive oxygen, nitrogen and sulfur species using thioredoxin as hydrogen donor; deletion enhances the mutator phenotype of tsa1 mutants; protein abundance increases in response to DNA replication stress; TSA2 has a paralog, TSA1, that arose from the whole genome duplication	0.446	1.400e-01	0.099	7.598e-01	-0.078	9.999e-01	-0.072	9.372e-01
CAGL0K06567g		Ortholog(s) have preribosome, large subunit precursor localization	-1.765	3.528e-05	-1.546	3.119e-05	-0.032	8.215e-01	-1.308	2.332e-04	-2.119	-2.105	-0.247	-2.396	-1	-1	0	-1	METABOLISM	RIBOSOMAL BIOGENESIS	F1	CAGL0K06567g	Type II	DOWN	DOWN	0	DOWN	CAGL0K06567g	YDR471W	S000002879	YDR471W	RPL27B	Ribosomal 60S subunit protein L27B; homologous to mammalian ribosomal protein L27, no bacterial homolog; RPL27B has a paralog, RPL27A, that arose from the whole genome duplication	-1.17	6.480e-04	-0.036	9.037e-01	-0.08	9.999e-01	-0.467	4.408e-01
CAGL0K06633g		Ortholog(s) have role in attachment of spindle microtubules to kinetochore, protein localization to kinetochore and COMA complex, kinetochore localization	-0.301	7.070e-02	-0.512	2.029e-02	-0.864	2.853e-04	-0.81	4.388e-03	-0.408	-0.746	-2.303	-1.526	0	0	-1	0	UNCLASSIFIED	_	Others	CAGL0K06633g	OFF	0	0	DOWN	DOWN	CAGL0K06633g	YBR211C	S000000415	YBR211C	AME1	Essential kinetochore protein associated with microtubules and SPBs; component of the kinetochore sub-complex COMA (Ctf19p, Okp1p, Mcm21p, Ame1p); involved in spindle checkpoint maintenance; orthologous to human centromere constitutive-associated network (CCAN) subunit CENP-U and fission yeast Mis17; relative distribution to the nucleus increases upon DNA replication stress	0.433	2.090e-02	-1.082	1.853e-03	0.036	9.999e-01	-0.157	6.526e-01
CAGL0K06677g	MET8	Putative bifunctional dehydrogenase and ferrochelatase; gene is upregulated in azole-resistant strain	0.666	9.674e-03	1.782	2.339e-05	0.914	6.059e-04	1.279	2.464e-04	0.721	2.268	2.09	2.129	0	1	1	1	IRON-SULFUR CLUSTER SYNTHESIS AND ASSEMBLY	_	F5	CAGL0K06677g	Type II	0	UP	UP	UP	CAGL0K06677g	YBR213W	S000000417	YBR213W	MET8	Bifunctional dehydrogenase and ferrochelatase; involved in the biosynthesis of siroheme, a prosthetic group used by sulfite reductase; required for sulfate assimilation and methionine biosynthesis	0.341	3.480e-02	0.332	9.278e-02	0.233	9.999e-01	0.039	9.366e-01
CAGL0K07111g		Ortholog(s) have microtubule binding, microtubule plus-end binding activity	-0.066	6.418e-01	0.059	7.964e-01	-0.221	9.235e-02	1.516	2.420e-03	-0.134	0.005	-0.713	2.543	0	0	0	1	REGULATION	OTHERS	F2	CAGL0K07111g	OFF	0	0	0	UP	CAGL0K07111g	YBR233W-A	S000007595	YBR233W-A	DAD3	Essential subunit of the Dam1 complex (aka DASH complex); complex couples kinetochores to the force produced by MT depolymerization thereby aiding in chromosome segregation; is transferred to the kinetochore prior to mitosis	-0.32	4.190e-02	-0.958	5.005e-03	0.107	9.999e-01	-0.072	8.654e-01
CAGL0K07183g		Protein of unknown function	0.353	3.941e-02	0.914	1.500e-02	0.9	2.160e-04	2.525	7.678e-04	0.356	1.127	2.056	4.308	0	0	1	1	UNCLASSIFIED	_	Others	CAGL0K07183g	OFF	0	0	UP	UP	CAGL0K07183g	NO_ORTHO	CAL0134049	CAGL0K07183g		Protein of unknown function	-1.378	8.230e-04	0.664	3.532e-02	0.177	9.999e-01	0.606	5.516e-01
CAGL0K07205g		Protein of unknown function	-1.762	2.738e-04	-0.287	2.791e-01	0.549	4.476e-02	-0.956	2.549e-03	-2.116	-0.451	1.189	-1.781	-1	0	0	0	UNCLASSIFIED	_	Others	CAGL0K07205g	Type II	DOWN	0	0	DOWN	CAGL0K07205g	NO_ORTHO	CAL0134653	CAGL0K07205g		Protein of unknown function	0.347	1.350e-01	0.143	6.758e-01	0.079	9.999e-01	0.163	8.435e-01
CAGL0K07436g		Ortholog(s) have DNA binding, tricarboxylate secondary active transmembrane transporter activity	-0.419	1.369e-02	0.601	7.580e-03	0.078	4.735e-01	1.207	3.201e-04	-0.546	0.716	0.024	2.003	0	0	0	1	TRANSPORT / TRAFFICKING	MITOCHONDRIA	F4	CAGL0K07436g	OFF	0	0	0	UP	CAGL0K07436g	YMR241W	S000004854	YMR241W	YHM2	Citrate and oxoglutarate carrier protein; exports citrate from and imports oxoglutarate into the mitochondrion, causing net export of NADPH reducing equivalents; also associates with mt nucleoids and has a role in replication and segregation of the mt genome	-0.638	4.650e-03	-0.193	4.623e-01	0.302	9.999e-01	-0.265	6.191e-01
CAGL0K07480g	PGM1	Putative phosphoglucomutase	2.195	8.062e-05	-0.385	9.323e-02	0.237	1.184e-01	-0.288	1.913e-01	2.507	-0.58	0.419	-0.613	1	0	0	0	REDOX SIGNALING	METABOLISM	F3	CAGL0K07480g	OFF	UP	0	0	0	CAGL0K07480g	YKL127W	S000001610	YKL127W	PGM1	Phosphoglucomutase, minor isoform; catalyzes the conversion from glucose-1-phosphate to glucose-6-phosphate, which is a key step in hexose metabolism; PGM1 has a paralog, PGM2, that arose from the whole genome duplication	1.626	5.560e-05	-0.768	1.394e-02	-0.088	9.999e-01	-0.418	3.716e-01
CAGL0K07546g	PMU2	Phosphate starvation inducible acid phosphatase; contains a phosphomutase-like domain; functionally complements a S. cerevisiae pho5 mutant; transcript abundance during phosphate starvation regulated by Pho4p	0.406	8.292e-02	0.968	4.055e-03	0.948	2.325e-04	5.706	1.843e-09	0.418	1.199	2.175	9.874	0	0	1	1	UNCLASSIFIED	_	Others	CAGL0K07546g	OFF	0	0	UP	UP	CAGL0K07546g	YKL128C	S000001611	YKL128C	PMU1	Putative phosphomutase; contains a region homologous to the active site of phosphomutases; overexpression suppresses the histidine auxotrophy of an ade3 ade16 ade17 triple mutant and the temperature sensitivity of a tps2 mutant	0.02	9.540e-01	0.121	7.948e-01	0.428	9.999e-01	-0.334	7.814e-01
CAGL0K07590g	MYO3	Putative myosin	-0.019	8.945e-01	0.075	7.338e-01	-0.801	4.507e-02	-0.74	4.411e-03	-0.079	0.025	-2.148	-1.404	0	0	-1	0	REGULATION	UNKNOWN	F2	CAGL0K07590g	NO	0	0	0	0	CAGL0K07590g	YKL129C	S000001612	YKL129C	MYO3	One of two type I myosins; localizes to actin cortical patches; deletion of MYO3 has little effect on growth, but myo3 myo5 double deletion causes severe defects in growth and actin cytoskeleton organization; MYO3 has a paralog, MYO5, that arose from the whole genome duplication	1.948	9.950e-06	0.457	2.431e-02	0.022	9.999e-01	-0.029	9.487e-01
CAGL0K07678g		Protein of unknown function	4.803	2.107e-07	3.726	1.334e-07	0.505	1.633e-02	0.636	1.606e-02	5.555	4.825	1.08	1.003	1	1	0	0	UNCLASSIFIED	_	Others	CAGL0K07678g	OFF	UP	UP	0	0	CAGL0K07678g	NO_ORTHO	CAL0134665	CAGL0K07678g		Protein of unknown function	2.597	1.180e-04	-0.134	4.837e-01	-0.186	9.999e-01	0.036	9.637e-01
CAGL0K08184g	CCP1	Cytochrome C peroxidase	-2.936	2.754e-06	-3.062	7.815e-07	0.189	8.130e-02	0.637	1.733e-02	-3.487	-4.098	0.299	1.006	-1	-1	0	0	REDOX SIGNALING	ROS DETOXIFICATION	F3	CAGL0K08184g	OFF	DOWN	DOWN	0	0	CAGL0K08184g	YKR066C	S000001774	YKR066C	CCP1	Mitochondrial cytochrome-c peroxidase; degrades reactive oxygen species in mitochondria, involved in the response to oxidative stress	-2.661	9.300e-06	2.897	2.199e-05	0.021	9.999e-01	0.681	1.035e-01
CAGL0K08206g		Protein of unknown function	0.967	1.475e-03	0.107	6.348e-01	0.533	1.787e-03	1.751	3.035e-05	1.073	0.068	1.149	2.955	0	0	0	1	TRANSPORT / TRAFFICKING	UNKNOWN	F4	CAGL0K08206g	OFF	0	0	0	UP	CAGL0K08206g	YGL140C	S000003108	YGL140C		Putative protein of unknown function; non-essential gene; contains multiple predicted transmembrane domains	-0.192	2.720e-01	-0.149	4.271e-01	-0.024	9.999e-01	-0.073	8.963e-01
CAGL0K08338g		Protein of unknown function	-0.719	1.534e-03	-1.912	4.011e-05	0.847	3.411e-04	0.037	8.981e-01	-0.897	-2.586	1.926	-0.044	0	-1	0	0	UNCLASSIFIED	_	Others	CAGL0K08338g	Type I	0	DOWN	UP	0	CAGL0K08338g	YOR385W	S000005912	YOR385W		Putative protein of unknown function; green fluorescent protein (GFP)-fusion protein localizes to the cytoplasm; YOR385W is not an essential gene	2.361	1.110e-04	-0.783	1.927e-02	-0.035	9.999e-01	-1.529	5.454e-02
CAGL0K08536g	APE1	Vacuolar aminopeptidase I	4.114	1.985e-06	2.645	3.943e-06	-0.152	2.817e-01	-0.378	1.313e-01	4.749	3.403	-0.544	-0.77	1	1	0	0	METABOLISM	PROTEIN DEGRADATION	F1	CAGL0K08536g	OFF	UP	UP	0	0	CAGL0K08536g	YKL103C	S000001586	YKL103C	APE1	Vacuolar aminopeptidase yscI; zinc metalloproteinase that belongs to the peptidase family M18; often used as a marker protein in studies of autophagy and cytosol to vacuole targeting (CVT) pathway; protein increases in abundance and relative distribution to cytoplasmic foci increases upon DNA replication stress	5.179	1.070e-06	1.042	3.911e-03	-0.428	9.999e-01	-0.267	6.509e-01
CAGL0K08668g	MET28	bZIP domain-containing protein	0.748	1.441e-01	2.211	1.356e-03	1.47	4.283e-03	0.946	1.426e-01	0.817	2.832	3.466	1.546	0	1	1	0	REGULATION	TRANSCRIPTIONAL REGULATOR	F2	CAGL0K08668g	Type II	0	UP	UP	0	CAGL0K08668g	YIR017C	S000001456	YIR017C	MET28	bZIP transcriptional activator in the Cbf1p-Met4p-Met28p complex; participates in the regulation of sulfur metabolism	1.928	8.210e-05	-0.516	2.403e-02	-0.443	9.999e-01	0.054	9.302e-01
CAGL0K08756g	AP5	bZIP domain-containing protein	3.796	2.107e-07	3.631	1.775e-07	-0.925	2.447e-04	-0.295	1.833e-01	4.378	4.7	-2.453	-0.625	1	1	-1	0	REGULATION	TRANSCRIPTIONAL REGULATOR	F2	CAGL0K08756g	Type I	UP	UP	DOWN	0	CAGL0K08756g	YIR018W	S000001457	YIR018W	YAP5	Basic leucine zipper (bZIP) iron-sensing transcription factor; involved in diauxic shift; YAP5 has a paralog, YAP7, that arose from the whole genome duplication	3.001	1.060e-05	-1.615	8.581e-04	0.063	9.999e-01	0.45	4.126e-01
CAGL0K09042g		Ortholog of S. cerevisiae : TMA16, C. albicans SC5314 : C1_09330W_A, C. dubliniensis CD36 : Cd36_08800, C. parapsilosis CDC317 : CPAR2_207530 and C. auris B8441 : B9J08_002306	-1.807	8.828e-06	-0.774	3.053e-03	-0.075	5.213e-01	-1.154	5.893e-04	-2.168	-1.09	-0.352	-2.127	-1	0	0	-1	UNCLASSIFIED	_	Others	CAGL0K09042g	Type II	DOWN	0	0	DOWN	CAGL0K09042g	YOR252W	S000005778	YOR252W	TMA16	Protein of unknown function that associates with ribosomes	-2.253	1.950e-05	0.71	9.763e-03	-0.032	9.999e-01	0.155	8.050e-01
CAGL0K09372g		Ortholog(s) have DNA-binding transcription repressor activity, RNA polymerase II-specific, RNA polymerase II proximal promoter sequence-specific DNA binding activity	0.646	8.007e-03	0.346	1.439e-01	-0.791	2.022e-03	-0.563	2.878e-02	0.698	0.381	-2.121	-1.093	0	0	-1	0	REGULATION	TRANSCRIPTIONAL REGULATOR	F2	CAGL0K09372g	OFF	0	0	DOWN	0	CAGL0K09372g	YGL209W	S000003177	YGL209W	MIG2	Zinc finger transcriptional repressor; cooperates with Mig1p in glucose-induced gene repression; under low glucose conditions relocalizes to mitochondrion, where it interacts with Ups1p, antagonizes mitochondrial fission factor Dnm1p, indicative of a role in mitochondrial fusion or regulating morphology; regulates filamentous growth in response to glucose depletion; activated in stochastic pulses of nuclear localization in response to low glucose	0.37	1.330e-01	0.225	5.141e-01	0.047	9.999e-01	0.561	3.994e-01
CAGL0K09702g		Putative stress-induced alcohol dehydrogenase; gene is upregulated in azole-resistant strain; protein differentially expressed in azole resistant strain	2.083	1.687e-06	2.565	1.147e-04	0.001	9.920e-01	0.762	5.618e-02	2.377	3.299	-0.164	1.224	1	1	0	0	REDOX SIGNALING	NAD(P)/NAD(P)H DEPENDANT ENZYME	F3	CAGL0K09702g	OFF	UP	UP	0	0	CAGL0K09702g	YNL134C	S000005078	YNL134C		NADH-dependent aldehyde reductase, involved in detoxification of furfural; expression is up-regulated in the presence of furfural and 5-hydroxymethylfurfural, which are compounds generated during lignocellulosic biomass pre-treatment; green fluorescent protein (GFP)-fusion protein localizes to both the cytoplasm and nucleus; protein abundance increases in response to DNA replication stress	2.791	2.460e-06	-1.077	7.165e-04	0.12	9.999e-01	0.034	9.516e-01
CAGL0K09724g	FPR1	Peptidyl-prolyl cis-trans isomerase; expression upregulated in biofilm vs planktonic cell culture	-0.685	1.132e-02	-0.887	7.715e-04	0.108	4.287e-01	-1.235	2.140e-04	-0.857	-1.24	0.1	-2.27	0	0	0	-1	REGULATION	OTHERS	F2	CAGL0K09724g	OFF	0	0	0	DOWN	CAGL0K09724g	YNL135C	S000005079	YNL135C	FPR1	Peptidyl-prolyl cis-trans isomerase (PPIase); binds to the drugs FK506 and rapamycin; also binds to the nonhistone chromatin binding protein Hmo1p and may regulate its assembly or function; N-terminally propionylated in vivo; mutation is functionally complemented by human FKBP1A	-0.78	9.050e-03	0.093	6.872e-01	0.061	9.999e-01	-0.317	6.459e-01
CAGL0K09988g		Ortholog(s) have role in vesicle-mediated transport and integral component of Golgi membrane localization	0.335	6.694e-02	0.38	8.893e-02	-0.903	7.354e-04	-0.278	2.808e-01	0.335	0.426	-2.398	-0.594	0	0	-1	0	TRANSPORT / TRAFFICKING	ER/GOLGI TRANSPORT SYSTEM	F4	CAGL0K09988g	OFF	0	0	DOWN	0	CAGL0K09988g	YDR084C	S000002491	YDR084C	TVP23	Integral membrane protein; localized to late Golgi vesicles along with the v-SNARE Tlg2p; green fluorescent protein (GFP)-fusion protein localizes to the cytoplasm in a punctate pattern	0.935	2.420e-04	-0.022	9.112e-01	0.041	9.999e-01	-0.341	6.886e-01
CAGL0K10340g	ADE2	Putative phosphoribosylaminoimidazole carboxylase; aminoimidazole ribonucleotide (AIR) carboxylase	0.059	8.061e-01	0.32	1.122e-01	1.149	6.924e-04	0.149	6.048e-01	0.012	0.348	2.671	0.152	0	0	1	0	METABOLISM	NUCLEIC ACID METABOLISM	F1	CAGL0K10340g	OFF	0	0	UP	0	CAGL0K10340g	YOR128C	S000005654	YOR128C	ADE2	Phosphoribosylaminoimidazole carboxylase; catalyzes a step in the 'de novo' purine nucleotide biosynthetic pathway; red pigment accumulates in mutant cells deprived of adenine	-0.935	3.840e-04	-0.653	7.519e-03	0.059	9.999e-01	-0.257	5.605e-01
CAGL0K10362g		Ortholog(s) have L-ornithine transmembrane transporter activity, role in arginine biosynthetic process, mitochondrial L-ornithine transmembrane transport and mitochondrial envelope localization	-2.752	7.835e-06	-0.97	6.244e-04	-0.43	2.274e-02	-0.766	5.772e-03	-3.272	-1.349	-1.23	-1.448	-1	0	0	0	TRANSPORT / TRAFFICKING	MITOCHONDRIA	F4	CAGL0K10362g	OFF	DOWN	0	0	0	CAGL0K10362g	YOR130C	S000005656	YOR130C	ORT1	Ornithine transporter of the mitochondrial inner membrane; exports ornithine from mitochondria as part of arginine biosynthesis; functionally complemented by human ortholog, SLC25A15, which is associated with hyperammonaemia-hyperornithinaemia-homocitrullinuria (HHH) syndrome, but HHH-associated variants fail to complement	-3.025	1.110e-05	0.801	2.350e-02	0.033	9.999e-01	0.091	8.959e-01
CAGL0K10428g		Ortholog(s) have enzyme inhibitor activity and role in negative regulation of glycogen catabolic process	0.488	1.915e-03	1.836	6.644e-06	0.163	2.320e-01	0.283	1.567e-01	0.513	2.341	0.234	0.387	0	1	0	0	METABOLISM	ENERGY PRODUCTION (NON RESPIRATORY)	F1	CAGL0K10428g	OFF	0	UP	0	0	CAGL0K10428g	YFR017C	S000001913	YFR017C	IGD1	Cytoplasmic protein that inhibits Gdb1p glycogen debranching activity; required for normal intracellular accumulation of glycogen; phosphorylated in vivo; expression increases during wine fermentation; protein abundance increases in response to DNA replication stress; IGD1 has a paralog, YOL024W, that arose from the whole genome duplication	2.789	5.100e-05	-2.184	8.710e-04	-0.321	9.999e-01	0.793	3.380e-01
CAGL0K10736g	CYB2	Ortholog(s) have L-lactate dehydrogenase (cytochrome) activity and mitochondrial intermembrane space, mitochondrion localization	2.074	9.623e-06	1.633	1.649e-05	0.211	1.288e-01	-0.185	5.187e-01	2.366	2.073	0.354	-0.432	1	1	0	0	REDOX SIGNALING	FLAVO HEMO PROTEIN	F3	CAGL0K10736g	OFF	UP	UP	0	0	CAGL0K10736g	YML054C	S000004518	YML054C	CYB2	Cytochrome b2 (L-lactate cytochrome-c oxidoreductase); component of the mitochondrial intermembrane space, required for lactate utilization; expression is repressed by glucose and anaerobic conditions	0.918	3.020e-04	-0.544	2.593e-02	-0.052	9.999e-01	0.29	5.137e-01
